season,fase,instancia,fecha,hora_inicio,hora_fin,local,visitante,marcador,global,estadio,ciudad,pais,arbitro_principal,arbitros_linea,entrenador_local,entrenador_visitante,planteles,puntuaciones_jugadores,tiros_totales,tiros_totales_local,tiros_totales_visitante,tiros_puerta,tiros_puerta_local,tiros_puerta_visitante,goles,asistencias,cambios,amarillas,rojas,posesion_local,posesion_visitante,faltas_total,faltas_local,faltas_visitante,corners_total,corners_local,corners_visitante
2021-2022,Cuartos,Vuelta,13-04-2022,19:00,21:00,Liverpool,Benfica,3-3,6-4,Anfield,Liverpool,Inglaterra,Serdar Gözübüyük,Joost van Zuilen; Johan Balder,Jurgen Klopp,Nelson Verissimo,Liverpool: Alisson Becker; Ibrahima Konaté; Joël Matip; Kostas Tsimikas; Joe Gomez; Jordan Henderson; James Milner; Naby Keïta; Diogo Jota; Luis Díaz; Roberto Firmino | Benfica: Odisseas Vlachodimos; Jan Vertonghen; Nicolás Otamendi; Alejandro Grimaldo; Gilberto; Gonçalo Ramos; Julian Weigl; Adel Taarabt; Diogo Gonçalves; Everton; Darwin Núñez,NULL,23,17,6,10,6,4,Konate 21'; Firmino 55'; 65'; Ramos 32'; Yaremchuk 73'; Nunez 82',NULL,45'' Roman Yaremchuk x Diogo Gonçalves; 57'' Mohamed Salah x Diogo Jota; 58'' Fabinho x Jordan Henderson; 58'' Thiago Alcantara x James Milner; 66'' Sadio Mané x Luis Díaz; 66'' João Mário x Adel Taarabt; 78'' Paulo Bernardo x Gonçalo Ramos; 90'+1'' Gil Dias x Gilberto; 90'+1'' Divock Origi x Roberto Firmino; 90'+1'' André Almeida x Everton,NULL,NULL,66%,34%,20,9,11,8,8,0
2021-2022,Cuartos,Ida,06-04-2022,19:00,21:00,Chelsea,Real Madrid,1-3,4-5,Stamford Bridge,Londres,Inglaterra,Clément Turpin,Cyril Gringore; Nicolas Danos,Thomas Tuchel,Carlo Ancelotti,Chelsea: Édouard Mendy; Thiago Silva; Antonio Rüdiger; Andreas Christensen; Jorginho; N'Golo Kanté; César Azpilicueta; Reece James; Christian Pulisic; Mason Mount; Kai Havertz | Real Madrid: Thibaut Courtois; David Alaba; Éder Militão; Ferland Mendy; Dani Carvajal; Casemiro; Toni Kroos; Luka Modric; Vinícius Júnior; Federico Valverde; Karim Benzema,NULL,28,20,8,10,5,5,Havertz 40'; Benzema 21'; 24'; 46',NULL,45'' Mateo Kovacic x Andreas Christensen; 45'' Hakim Ziyech x N'Golo Kanté; 64'' Ruben Loftus-Cheek x Jorginho; 64'' Romelu Lukaku x Christian Pulisic; 64'' Nacho x Éder Militão; 74'' Eduardo Camavinga x Toni Kroos; 86'' Gareth Bale x Karim Benzema; 86'' Dani Ceballos x Federico Valverde,Éder Militão 14''; Antonio Rüdiger 18'',NULL,57%,43%,20,14,6,7,5,2
2021-2022,Cuartos,Vuelta,12-04-2022,19:00,21:00,Real Madrid,Chelsea,2-3,5-4,Santiago Bernabeu,Madrid,España,Szymon Marciniak,Tomasz Listkiewicz; Paweł Sokolnicki,Carlo Ancelotti,Thomas Tuchel,Real Madrid: Thibaut Courtois; David Alaba; Nacho; Ferland Mendy; Dani Carvajal; Casemiro; Toni Kroos; Luka Modric; Vinícius Júnior; Federico Valverde; Karim Benzema | Chelsea: Édouard Mendy; Thiago Silva; Antonio Rüdiger; Reece James; Mateo Kovacic; N'Golo Kanté; Mason Mount; Marcos Alonso; Ruben Loftus-Cheek; Timo Werner; Kai Havertz,NULL,38,10,28,11,4,7,Rodrygo 80'; Benzema 96'; Mount 15'; Rudiger 51'; Werner 75',NULL,73'' Eduardo Camavinga x Toni Kroos; 78'' Marcelo x Ferland Mendy; 78'' Rodrygo x Casemiro; 83'' Christian Pulisic x Timo Werner; 88'' Lucas Vázquez x Nacho; 99'' Hakim Ziyech x N'Golo Kanté; 105'' Jorginho x Mateo Kovacic; 105'' Saúl Ñíguez x Ruben Loftus-Cheek; 115'' Dani Ceballos x Vinícius Júnior,Reece James 10''; Karim Benzema 37''; Federico Valverde 68''; Eduardo Camavinga 90'+1''; Hakim Ziyech 102''; Kai Havertz 109''; César Azpilicueta 113''; Dani Carvajal 118'',NULL,43%,57%,37,17,20,11,1,10
2021-2022,Cuartos,Ida,06-04-2022,19:00,21:00,Villarreal,Bayern Munich,1-0,2-1,Estadio de la Ceramica,Villarreal,España,Anthony Taylor,Adam Nunn; Gary Beswick,Unai Emery,Julian Nagelsmann,Villarreal: Gerónimo Rulli; Pau Torres; Raúl Albiol; Pervis Estupiñán; Juan Foyth; Dani Parejo; Étienne Capoue; Francis Coquelin; Giovani Lo Celso; Arnaut Danjuma; Gerard Moreno | Bayern Munich: Manuel Neuer; Lucas Hernández; Dayot Upamecano; Alphonso Davies; Benjamin Pavard; Thomas Müller; Jamal Musiala; Joshua Kimmich; Serge Gnabry; Kingsley Coman; Robert Lewandowski,NULL,34,12,22,5,1,4,Danjuma 8',NULL,59'' Alfonso Pedraza x Francis Coquelin; 62'' Leon Goretzka x Thomas Müller; 62'' Leroy Sané x Serge Gnabry; 71'' Niklas Süle x Benjamin Pavard; 81'' Samuel Chukwueze x Arnaut Danjuma; 81'' Sèrge Aurier x Juan Foyth; 90'+4'' Marc Roca x Leon Goretzka,Pervis Estupiñán 74'',NULL,38%,62%,19,10,9,9,3,6
2021-2022,Cuartos,Vuelta,12-04-2022,19:00,21:00,Bayern Munich,Villarreal,1-1,1-2,Allianz Arena,Munich,Alemania,Slavko Vinčić,Andraž Kovačič; Tomaž Klančnik,Julian Nagelsmann,Unai Emery,Bayern Munich: Manuel Neuer; Dayot Upamecano; Lucas Hernández; Benjamin Pavard; Leon Goretzka; Joshua Kimmich; Kingsley Coman; Leroy Sané; Jamal Musiala; Thomas Müller; Robert Lewandowski | Villarreal: Gerónimo Rulli; Pau Torres; Raúl Albiol; Pervis Estupiñán; Juan Foyth; Dani Parejo; Étienne Capoue; Francis Coquelin; Giovani Lo Celso; Arnaut Danjuma; Gerard Moreno,NULL,27,23,4,5,4,1,Lewandowski 52'; Chukwueze 88',NULL,82'' Serge Gnabry x Jamal Musiala; 84'' Samuel Chukwueze x Francis Coquelin; 84'' Alfonso Pedraza x Arnaut Danjuma; 87'' Alphonso Davies x Lucas Hernández; 90'' Eric Maxim Choupo-Moting x Thomas Müller; 90'+3'' Sèrge Aurier x Dani Parejo,Robert Lewandowski 33''; Juan Foyth 59''; Giovani Lo Celso 90'+1'',NULL,68%,32%,19,11,8,6,6,0
2021-2022,Semifinal,Ida,26-04-2022,19:00,21:00,Manchester City,Real Madrid,4-3,6-5,Etihad Stadium,Manchester,Inglaterra,István Kovács,Vasile Marinescu; Ovidiu Artene,Pep Guardiola,Carlo Ancelotti,Manchester City: Ederson ; Aymeric Laporte; Rúben Dias; Oleksandr Zinchenko; John Stones; Rodri; Kevin De Bruyne; Bernardo Silva; Phil Foden; Riyad Mahrez; Gabriel Jesus | Real Madrid: Thibaut Courtois; David Alaba; Éder Militão; Ferland Mendy; Dani Carvajal; Toni Kroos; Luka Modric; Federico Valverde; Vinícius Júnior; Rodrygo; Karim Benzema,NULL,27,16,11,11,6,5,De Bruyne 2'; Jesus 11'; Foden 53'; Bernardo Silva 74'; Benzema 33'; 82'; Vinicius 55',NULL,36'' Fernandinho x John Stones; 45'' Nacho x David Alaba; 70'' Eduardo Camavinga x Rodrygo; 79'' Dani Ceballos x Luka Modric; 83'' Raheem Sterling x Gabriel Jesus; 88'' Marco Asensio x Vinícius Júnior,Fernandinho 81''; Nacho 90'+3'',Karim Benzema 82'',60%,40%,16,11,5,8,5,3
2021-2022,Semifinal,Vuelta,04-05-2022,19:00,21:00,Real Madrid,Manchester City,3-1,6-5,Santiago Bernabeu,Madrid,España,Daniele Orsato,Ciro Carbone; Alessandro Giallatini,Carlo Ancelotti,Pep Guardiola,Real Madrid: Thibaut Courtois; Nacho; Éder Militão; Ferland Mendy; Dani Carvajal; Luka Modric; Toni Kroos; Casemiro; Vinícius Júnior; Federico Valverde; Karim Benzema | Manchester City: Ederson ; Aymeric Laporte; Rúben Dias; João Cancelo; Kyle Walker; Rodri; Kevin De Bruyne; Bernardo Silva; Phil Foden; Riyad Mahrez; Gabriel Jesus,NULL,29,14,15,15,5,10,Rodrygo 90'; 91'; Benzema 95'; Mahrez 73',NULL,68'' Rodrygo x Toni Kroos; 72'' Oleksandr Zinchenko x Kyle Walker; 72'' Ilkay Gündogan x Kevin De Bruyne; 75'' Marco Asensio x Casemiro; 75'' Eduardo Camavinga x Luka Modric; 78'' Jack Grealish x Gabriel Jesus; 85'' Fernandinho x Riyad Mahrez; 99'' Raheem Sterling x Rodri; 104'' Dani Ceballos x Karim Benzema; 115'' Jesús Vallejo x Éder Militão; 115'' Lucas Vázquez x Vinícius Júnior,Aymeric Laporte 9''; Luka Modric 9''; Dani Carvajal 65''; Éder Militão 84''; Federico Valverde 90'+6''; Raheem Sterling 101''; Oleksandr Zinchenko 113'',Karim Benzema 95'',44%,56%,32,14,18,13,3,10
2021-2022,Semifinal,Ida,27-04-2022,19:00,21:00,Liverpool,Villarreal,2-0,5-2,Anfield,Liverpool,Inglaterra,Szymon Marciniak,Paweł Sokolnicki; Tomasz Listkiewicz,Jurgen Klopp,Unai Emery,Liverpool: Alisson Becker; Virgil van Dijk; Ibrahima Konaté; Andrew Robertson; Trent Alexander-Arnold; Fabinho; Thiago Alcantara; Jordan Henderson; Luis Díaz; Mohamed Salah; Sadio Mané | Villarreal: Gerónimo Rulli; Pau Torres; Raúl Albiol; Pervis Estupiñán; Juan Foyth; Dani Parejo; Étienne Capoue; Francis Coquelin; Giovani Lo Celso; Arnaut Danjuma; Samuel Chukwueze,NULL,20,19,1,5,5,0,Henderson OG 53'; Mane 55',NULL,57'' Alfonso Pedraza x Francis Coquelin; 71'' Sèrge Aurier x Dani Parejo; 72'' Manu Trigueros x Pervis Estupiñán; 72'' Boulaye Dia x Samuel Chukwueze; 72'' Naby Keïta x Jordan Henderson; 73'' Diogo Jota x Sadio Mané; 81'' Joe Gomez x Trent Alexander-Arnold; 81'' Divock Origi x Luis Díaz; 86'' Paco Alcácer x Arnaut Danjuma,Virgil van Dijk 32''; Pervis Estupiñán 47''; Giovani Lo Celso 62'',NULL,73%,27%,16,9,7,12,10,2
2021-2022,Semifinal,Vuelta,03-05-2022,19:00,21:00,Villarreal,Liverpool,2-3,2-5,Estadio de la Ceramica,Villarreal,España,Danny Makkelie,Jan de Vries; Hessel Steegstra,Unai Emery,Jurgen Klopp,Villarreal: Gerónimo Rulli; Pau Torres; Raúl Albiol; Pervis Estupiñán; Juan Foyth; Étienne Capoue; Dani Parejo; Francis Coquelin; Giovani Lo Celso; Boulaye Dia; Gerard Moreno | Liverpool: Alisson Becker; Virgil van Dijk; Ibrahima Konaté; Andrew Robertson; Trent Alexander-Arnold; Fabinho; Thiago Alcantara; Naby Keïta; Sadio Mané; Mohamed Salah; Diogo Jota,NULL,21,6,15,7,2,5,Dia 3'; Coquelin 41'; Fabinho 62'; Diaz 67'; Mane 74',NULL,45'' Luis Díaz x Diogo Jota; 68'' Samuel Chukwueze x Gerard Moreno; 68'' Alfonso Pedraza x Francis Coquelin; 79'' Manu Trigueros x Pervis Estupiñán; 79'' Jordan Henderson x Naby Keïta; 79'' Kostas Tsimikas x Andrew Robertson; 79'' Sèrge Aurier x Raúl Albiol; 79'' Paco Alcácer x Boulaye Dia; 80'' Curtis Jones x Thiago Alcantara; 84'' James Milner x Fabinho,Étienne Capoue 63''; Trent Alexander-Arnold 77''; Giovani Lo Celso 81''; Pau Torres 85'',Étienne Capoue 85'',44%,56%,32,18,14,3,1,2
2021-2022,Final,Final,28-05-2022,19:00,21:00,Liverpool,Real Madrid,0-1,NULL,Stade de France,Paris,Francia,Clément Turpin,Cyril Gringore; Nicolas Danos,Jurgen Klopp,Carlo Ancelotti,Liverpool: Alisson Becker; Virgil van Dijk; Ibrahima Konaté; Andrew Robertson; Trent Alexander-Arnold; Fabinho; Thiago Alcantara; Jordan Henderson; Luis Díaz; Mohamed Salah; Sadio Mané | Real Madrid: Thibaut Courtois; David Alaba; Éder Militão; Ferland Mendy; Dani Carvajal; Casemiro; Toni Kroos; Luka Modric; Vinícius Júnior; Federico Valverde; Karim Benzema,NULL,28,24,4,11,9,2,Vinicius 59',NULL,65'' Diogo Jota x Luis Díaz; 77'' Naby Keïta x Jordan Henderson; 77'' Roberto Firmino x Thiago Alcantara; 85'' Eduardo Camavinga x Federico Valverde; 90'' Dani Ceballos x Luka Modric; 90'+3'' Rodrygo x Vinícius Júnior,Fabinho 62'',NULL,54%,46%,20,13,7,8,6,2
2022-2023,Octavos,Ida,14-02-2023,20:00,22:00,PSG,Bayern Munich,0-1,0-3,Parc des Princes,Paris,Francia,Michael Oliver,Stuart Burt; Simon Bennett,Christophe Galtier,Julian Nagelsmann,Bayern Munich: Yann Sommer; Dayot Upamecano; Matthijs de Ligt; Benjamin Pavard; Leon Goretzka; Joshua Kimmich; Kingsley Coman; João Cancelo; Jamal Musiala; Leroy Sané; Eric Maxim Choupo-Moting | Paris Saint-Germain: Gianluigi Donnarumma; Sergio Ramos; Marquinhos; Nuno Mendes; Achraf Hakimi; Danilo Pereira; Marco Verratti; Carlos Soler; Warren Zaïre-Emery; Neymar; Lionel Messi,NULL,27,18,9,11,7,4,Coman 53',NULL,45'' Presnel Kimpembe x Achraf Hakimi; 45'' Alphonso Davies x João Cancelo; 57'' Kylian Mbappé x Carlos Soler; 57'' Fabián Ruiz x Warren Zaïre-Emery; 75'' Vitinha x Danilo Pereira; 75'' Serge Gnabry x Kingsley Coman; 76'' Thomas Müller x Eric Maxim Choupo-Moting; 87'' Ryan Gravenberch x Jamal Musiala; 90'' Josip Stanisic x Leroy Sané,Benjamin Pavard 26''; Presnel Kimpembe 70''; Neymar 86'',Benjamin Pavard 90'+2'',54%,46%,26,18,8,9,5,4
2022-2023,Octavos,Vuelta,08-03-2023,20:00,22:00,Bayern Munich,PSG,2-0,3-0,Allianz Arena,Munich,Alemania,Daniele Orsato,Alessandro Giallatini; Ciro Carbone,Julian Nagelsmann,Christophe Galtier,Bayern Munich: Yann Sommer; Matthijs de Ligt; Dayot Upamecano; Alphonso Davies; Josip Stanisic; Thomas Müller; Joshua Kimmich; Leon Goretzka; Jamal Musiala; Kingsley Coman; Eric Maxim Choupo-Moting | Paris Saint-Germain: Gianluigi Donnarumma; Sergio Ramos; Marquinhos; Danilo Pereira; Fabián Ruiz; Vitinha; Marco Verratti; Nuno Mendes; Achraf Hakimi; Kylian Mbappé; Lionel Messi,NULL,22,12,10,9,5,4,Choupo-Moting 61'; Gnabry 89',NULL,36'' Nordi Mukiele x Marquinhos; 45'' El Chadaille Bitshiabu x Nordi Mukiele; 68'' Leroy Sané x Eric Maxim Choupo-Moting; 76'' Warren Zaïre-Emery x Fabián Ruiz; 81'' Hugo Ekitike x Vitinha; 82'' Juan Bernat x Nuno Mendes; 82'' Sadio Mané x Jamal Musiala; 86'' Serge Gnabry x Kingsley Coman; 86'' João Cancelo x Thomas Müller,Achraf Hakimi 90'+5'',NULL,45%,55%,15,9,6,10,4,6
2022-2023,Octavos,Ida,14-02-2023,20:00,22:00,AC Milan,Tottenham,1-0,1-0,San Siro,Milán,Italia,Sandro Schärer,Stéphane De Almeida; Bekim Zogaj,Stefano Pioli,Antonio Conte,AC Milan: Ciprian Tatarusanu; Simon Kjaer; Malick Thiaw; Pierre Kalulu; Sandro Tonali; Rade Krunic; Theo Hernández; Alexis Saelemaekers; Rafael Leão; Brahim Díaz; Olivier Giroud | Tottenham Hotspur: Fraser Forster; Eric Dier; Clément Lenglet; Cristian Romero; Pape Matar Sarr; Oliver Skipp; Ivan Perisic; Emerson Royal; Son Heung-Min; Dejan Kulusevski; Harry Kane,NULL,20,9,11,7,4,3,Brahim Diaz 7',NULL,70'' Richarlison x Dejan Kulusevski; 77'' Junior Messias x Alexis Saelemaekers; 77'' Charles De Ketelaere x Brahim Díaz; 81'' Arnaut Danjuma x Son Heung-Min; 81'' Ben Davies x Clément Lenglet; 86'' Tommaso Pobega x Sandro Tonali; 90'+1'' Ante Rebic x Rafael Leão,Cristian Romero 48''; Eric Dier 63''; Sandro Tonali 80''; Theo Hernández 90'+2'',NULL,47%,53%,30,17,13,11,3,8
2022-2023,Octavos,Vuelta,08-03-2023,20:10,22:10,Tottenham,AC Milan,0-0,0-1,Tottenham Hotspur Stadium,Londres,Inglaterra,Clément Turpin,Nicolas Danos; Benjamin Pages,Antonio Conte,Stefano Pioli,Tottenham Hotspur: Fraser Forster; Clément Lenglet; Ben Davies; Cristian Romero; Pierre-Emile Højbjerg; Oliver Skipp; Ivan Perisic; Emerson Royal; Son Heung-Min; Dejan Kulusevski; Harry Kane | AC Milan: Mike Maignan; Malick Thiaw; Fikayo Tomori; Pierre Kalulu; Sandro Tonali; Rade Krunic; Theo Hernández; Junior Messias; Rafael Leão; Brahim Díaz; Olivier Giroud,NULL,23,9,14,5,2,3,NULL,NULL,53'' Pedro Porro x Ivan Perisic; 56'' Alexis Saelemaekers x Junior Messias; 70'' Richarlison x Emerson Royal; 81'' Ismaël Bennacer x Brahim Díaz; 81'' Divock Origi x Olivier Giroud; 83'' Davinson Sánchez x Dejan Kulusevski; 89'' Ante Rebic x Rafael Leão,Cristian Romero 17''; Clément Lenglet 21''; Malick Thiaw 90'+3''; Oliver Skipp 90'+5'',Cristian Romero 77'',54%,46%,30,18,12,6,6,0
2022-2023,Octavos,Ida,15-02-2023,20:00,22:00,Club Brugge,Benfica,0-2,1-7,Jan Breydel Stadium,Brujas,Belgica,Davide Massa,Stefano Alassio; Filippo Meli,Scott Parker,Roger Schmidt,Club Brugge: Simon Mignolet; Brandon Mechele; Jack Hendry; Bjorn Meijer; Clinton Mata; Hans Vanaken; Raphael Onyedika; Denis Odoi; Tajon Buchanan; Kamal Sowah; Noa Lang | Benfica: Odisseas Vlachodimos; Nicolás Otamendi; António Silva; Alejandro Grimaldo; Alexander Bah; Rafa Silva; Chiquinho; Florentino; Fredrik Aursnes; João Mário; Gonçalo Ramos,NULL,18,4,14,5,1,4,Joao Mario 51'; Neres 88',NULL,65'' David Neres x Rafa Silva; 65'' Casper Hojer Nielsen x Denis Odoi; 65'' Gonçalo Guedes x Gonçalo Ramos; 79'' Ferran Jutglà x Kamal Sowah; 90'+4'' João Neves x João Mário,Denis Odoi 9''; Kamal Sowah 29''; Nicolás Otamendi 43'',João Mário 51'',45%,55%,18,10,8,10,3,7
2022-2023,Octavos,Vuelta,07-03-2023,20:00,22:00,Benfica,Club Brugge,5-1,7-1,Estadio da Luz,Lisboa,Portugal,Umut Meler,Emre Eyisoy; Cevdet Komurcuoglu,Roger Schmidt,Scott Parker,Benfica: Odisseas Vlachodimos; Nicolás Otamendi; António Silva; Alejandro Grimaldo; Alexander Bah; Rafa Silva; Chiquinho; Florentino; Fredrik Aursnes; João Mário; Gonçalo Ramos | Club Brugge: Simon Mignolet; Brandon Mechele; Abakar Sylla; Clinton Mata; Hans Vanaken; Tajon Buchanan; Casper Hojer Nielsen; Bjorn Meijer; Kamal Sowah; Noa Lang; Roman Yaremchuk,NULL,33,20,13,10,8,2,Ramos 38'; 57'; 67'; Joao Mario 71'; Neres 77'; Meijer 87',NULL,45'' Raphael Onyedika x Noa Lang; 62'' Ferran Jutglà x Roman Yaremchuk; 62'' Denis Odoi x Clinton Mata; 63'' David Neres x Chiquinho; 63'' Gilberto x Alexander Bah; 74'' João Neves x João Mário; 74'' Morato x Nicolás Otamendi; 74'' Mats Rits x Hans Vanaken; 75'' Antonio Nusa x Kamal Sowah; 88'' Lucas Verissimo x António Silva,Roman Yaremchuk 17''; Noa Lang 20''; Nicolás Otamendi 29''; Abakar Sylla 43''; Bjorn Meijer 49'',João Mário 71'',60%,40%,10,3,7,7,2,5
2022-2023,Octavos,Ida,15-02-2023,20:00,22:00,Borussia Dortmund,Chelsea,1-0,1-2,Signal Iduna Park,Dortmund,Alemania,Jesús Gil Manzano,Ángel Nevado; Diego Barbero,Edin Terzic,Graham Potter,Borussia Dortmund: Gregor Kobel; Nico Schlotterbeck; Niklas Süle; Emre Can; Raphaël Guerreiro; Marius Wolf; Salih Özcan; Jude Bellingham; Karim Adeyemi; Julian Brandt; Sébastien Haller | Chelsea: Kepa Arrizabalaga; Kalidou Koulibaly; Thiago Silva; Ben Chilwell; Reece James; João Félix; Enzo Fernández; Ruben Loftus-Cheek; Mykhailo Mudryk; Hakim Ziyech; Kai Havertz,NULL,35,14,21,10,2,8,Adeyemi 63',NULL,68'' Anthony Modeste x Sébastien Haller; 71'' Mason Mount x Mykhailo Mudryk; 71'' Marc Cucurella x Ben Chilwell; 73'' Julian Ryerson x Marius Wolf; 79'' Jamie Gittens x Karim Adeyemi,Reece James 9''; Thiago Silva 16''; Jude Bellingham 49''; Emre Can 53''; Hakim Ziyech 72''; Karim Adeyemi 77''; Salih Özcan 85''; Julian Ryerson 90''; Niklas Süle 90''; Mason Mount 90'',NULL,48%,52%,25,13,12,15,5,10
2022-2023,Octavos,Vuelta,07-03-2023,20:10,22:10,Chelsea,Borussia Dortmund,2-0,2-1,Stamford Bridge,Londres,Inglaterra,Danny Makkelie,Rogier Honig; Jan de Vries,Graham Potter,Edin Terzic,Chelsea: Kepa Arrizabalaga; Kalidou Koulibaly; Marc Cucurella; Wesley Fofana; Mateo Kovacic; Enzo Fernández; Ben Chilwell; Reece James; João Félix; Raheem Sterling; Kai Havertz | Borussia Dortmund: Alexander Meyer; Nico Schlotterbeck; Niklas Süle; Emre Can; Raphaël Guerreiro; Marius Wolf; Salih Özcan; Jude Bellingham; Marco Reus; Julian Brandt; Sébastien Haller,NULL,26,13,13,8,4,4,Sterling 43'; Havertz 53',NULL,5'' Giovanni Reyna x Julian Brandt; 64'' Jamie Gittens x Salih Özcan; 67'' Conor Gallagher x João Félix; 77'' Donyell Malen x Sébastien Haller; 82'' Ruben Loftus-Cheek x Raheem Sterling; 83'' Christian Pulisic x Mateo Kovacic; 87'' Denis Zakaria x Enzo Fernández,Niklas Süle 41''; Kepa Arrizabalaga 65''; Enzo Fernández 77''; Ben Chilwell 90'+2''; Marius Wolf 90'+2''; Marc Cucurella 90'+6''; Jude Bellingham 90'+8'',Kai Havertz 53'',40%,60%,26,17,9,8,5,3
2022-2023,Octavos,Ida,21-02-2023,20:00,22:00,Liverpool,Real Madrid,2-5,2-6,Anfield,Liverpool,Inglaterra,István Kovács,Vasile Marinescu; Ovidiu Artene,Jurgen Klopp,Carlo Ancelotti,Liverpool: Alisson Becker; Virgil van Dijk; Joe Gomez; Andrew Robertson; Trent Alexander-Arnold; Fabinho; Stefan Bajcetic; Jordan Henderson; Darwin Núñez; Mohamed Salah; Cody Gakpo | Real Madrid: Thibaut Courtois; Antonio Rüdiger; Éder Militão; David Alaba; Dani Carvajal; Eduardo Camavinga; Luka Modric; Federico Valverde; Vinícius Júnior; Rodrygo; Karim Benzema,NULL,18,9,9,11,5,6,Nunez 4'; Salah 14'; Vinicius 21'; 36'; Militao 47'; Benzema 55'; 67',NULL,27'' Nacho x David Alaba; 64'' Roberto Firmino x Cody Gakpo; 64'' Diogo Jota x Darwin Núñez; 73'' Joël Matip x Joe Gomez; 73'' James Milner x Jordan Henderson; 81'' Dani Ceballos x Rodrygo; 85'' Harvey Elliott x Stefan Bajcetic; 87'' Marco Asensio x Karim Benzema; 87'' Toni Kroos x Luka Modric,Vinícius Júnior 60''; Harvey Elliott 90'+3'',NULL,52%,48%,18,9,9,7,4,3
2022-2023,Octavos,Vuelta,15-03-2023,20:00,22:00,Real Madrid,Liverpool,1-0,6-2,Santiago Bernabeu,Madrid,España,Felix Zwayer,Marco Achmüller; Stefan Lupp,Carlo Ancelotti,Jurgen Klopp,Real Madrid: Thibaut Courtois; Antonio Rüdiger; Éder Militão; Nacho; Dani Carvajal; Eduardo Camavinga; Toni Kroos; Luka Modric; Vinícius Júnior; Federico Valverde; Karim Benzema | Liverpool: Alisson Becker; Virgil van Dijk; Ibrahima Konaté; Andrew Robertson; Trent Alexander-Arnold; Fabinho; James Milner; Cody Gakpo; Darwin Núñez; Mohamed Salah; Diogo Jota,NULL,26,17,9,13,8,5,Benzema 78',NULL,57'' Harvey Elliott x Diogo Jota; 57'' Roberto Firmino x Darwin Núñez; 73'' Alex Oxlade-Chamberlain x James Milner; 82'' Dani Ceballos x Luka Modric; 82'' Rodrygo x Karim Benzema; 84'' Marco Asensio x Vinícius Júnior; 84'' Aurélien Tchouaméni x Toni Kroos; 86'' Lucas Vázquez x Dani Carvajal; 90'+1'' Fábio Carvalho x Cody Gakpo; 90'+1'' Kostas Tsimikas x Andrew Robertson,Kostas Tsimikas 90'+4'',NULL,54%,46%,24,7,17,14,5,9
2022-2023,Octavos,Ida,21-02-2023,20:00,22:00,Eintracht Frankfurt,Napoli,0-2,0-5,Deutsche Bank Park,Frankfurt,Alemania,Artur Soares Dias,Paulo Soares; Pedro Ribeiro,Oliver Glasner,Luciano Spalletti,Eintracht Frankfurt: Kevin Trapp; Kristijan Jakic; Evan Ndicka; Tuta; Djibril Sow; Daichi Kamada; Philipp Max; Buta; Mario Götze; Jesper Lindstrom; Randal Kolo Muani | Napoli: Alex Meret; Kim Min-Jae; Amir Rrahmani; Mathías Olivera; Giovanni Di Lorenzo; Stanislav Lobotka; Piotr Zielinski; Frank Anguissa; Khvicha Kvaratskhelia; Hirving Lozano; Victor Osimhen,NULL,23,5,18,11,1,10,Osimhen 40'; Di Lorenzo 65',NULL,69'' Ansgar Knauff x Buta; 69'' Rafael Borré x Jesper Lindstrom; 80'' Eljif Elmas x Hirving Lozano; 80'' Tanguy Ndombele x Frank Anguissa; 81'' Faride Alidou x Mario Götze; 84'' Matteo Politano x Khvicha Kvaratskhelia; 84'' Giovanni Simeone x Victor Osimhen; 90'+2'' Christopher Lenz x Philipp Max,Kim Min-Jae 38''; Mario Götze 60''; Eljif Elmas 83'',Kolo Muani,30%,70%,25,12,13,13,4,9
2022-2023,Octavos,Vuelta,15-03-2023,20:00,22:00,Napoli,Eintracht Frankfurt,3-0,5-0,Stadio Diego Armando Maradona,Napoles,Italia,Anthony Taylor,Lee Betts; Gary Beswick,Luciano Spalletti,Oliver Glasner,Napoli: Alex Meret; Kim Min-Jae; Amir Rrahmani; Mário Rui; Giovanni Di Lorenzo; Stanislav Lobotka; Piotr Zielinski; Frank Anguissa; Khvicha Kvaratskhelia; Matteo Politano; Victor Osimhen | Eintracht Frankfurt: Kevin Trapp; Evan Ndicka; Tuta; Christopher Lenz; Buta; Mario Götze; Djibril Sow; Sebastian Rode; Daichi Kamada; Ansgar Knauff; Rafael Borré,NULL,20,12,8,9,8,1,Osimhen 45'; 53'; Zielinski 64',NULL,62'' Faride Alidou x Ansgar Knauff; 66'' Juan Jesus x Kim Min-Jae; 67'' Hirving Lozano x Matteo Politano; 67'' Philipp Max x Christopher Lenz; 74'' Eljif Elmas x Khvicha Kvaratskhelia; 74'' Tanguy Ndombele x Piotr Zielinski; 74'' Kristijan Jakic x Sebastian Rode; 81'' Giovanni Simeone x Victor Osimhen,Evan Ndicka 26''; Christopher Lenz 32''; Mario Götze 65''; Juan Jesus 77'',Piotr Zielinski 64'',60%,40%,28,13,15,7,4,3
2022-2023,Octavos,Ida,22-02-2023,20:00,22:00,Inter,Porto,1-0,1-0,San Siro,Milán,Italia,Srdjan Jovanović,Uroš Stojković; Milan Mihajlović,Simone Inzaghi,Sergio Conceicao,Internazionale: André Onana; Francesco Acerbi; Alessandro Bastoni; Milan Skriniar; Henrikh Mkhitaryan; Nicolò Barella; Hakan Çalhanoglu; Federico Dimarco; Matteo Darmian; Edin Dzeko; Lautaro Martínez | FC Porto: Diogo Costa; Iván Marcano; Pepe; Zaidu Sanusi; João Mário; Otávio; Mateus Uribe; Marko Grujic; Galeno; Pepê; Mehdi Taremi,NULL,28,18,10,8,4,4,Lukaku 86',NULL,51'' Evanilson x Galeno; 58'' Romelu Lukaku x Edin Dzeko; 58'' Robin Gosens x Federico Dimarco; 72'' Marcelo Brozovic x Henrikh Mkhitaryan; 81'' Denzel Dumfries x Milan Skriniar; 83'' Wendell x Mehdi Taremi; 90'+2'' Gonçalo Borges x João Mário,Otávio 41''; Federico Dimarco 41''; Pepê 63'',Otávio 78'',60%,40%,29,15,14,7,7,0
2022-2023,Octavos,Vuelta,14-03-2023,20:00,22:00,Porto,Inter,0-0,0-1,Estadio do Dragao,Porto,Portugal,Szymon Marciniak,Tomasz Listkiewicz; Paweł Sokolnicki,Sergio Conceicao,Simone Inzaghi,FC Porto: Diogo Costa; Iván Marcano; Fábio Cardoso; Zaidu Sanusi; Pepê; Stephen Eustáquio; Mateus Uribe; Marko Grujic; Galeno; Evanilson; Mehdi Taremi | Internazionale: André Onana; Francesco Acerbi; Alessandro Bastoni; Matteo Darmian; Henrikh Mkhitaryan; Nicolò Barella; Hakan Çalhanoglu; Federico Dimarco; Denzel Dumfries; Edin Dzeko; Lautaro Martínez,NULL,32,21,11,12,7,5,NULL,NULL,70'' Romelu Lukaku x Edin Dzeko; 70'' Danilo D'Ambrosio x Federico Dimarco; 70'' André Franco x Stephen Eustáquio; 71'' Toni Martínez x Evanilson; 74'' Stefan de Vrij x Alessandro Bastoni; 80'' Milan Skriniar x Matteo Darmian; 80'' Marcelo Brozovic x Nicolò Barella; 85'' Wendell x Zaidu Sanusi; 85'' Danny Namaso x Mateus Uribe,Matteo Darmian 33''; Edin Dzeko 69''; Pepê 79''; Francesco Acerbi 89'',Pepê 90'+7'',68%,32%,29,11,18,10,6,4
2022-2023,Octavos,Ida,22-02-2023,20:00,22:00,RB Leipzig,Manchester City,1-1,1-8,Red Bull Arena,Leipzig,Alemania,Serdar Gözübüyük,Johan Balder; Erwin Zeinstra,Marco Rose,Pep Guardiola,RB Leipzig: Janis Blaswich; Josko Gvardiol; Willi Orbán; Marcel Halstenberg; Lukas Klostermann; Emil Forsberg; Xaver Schlager; Konrad Laimer; Timo Werner; Dominik Szoboszlai; André Silva | Manchester City: Ederson ; Rúben Dias; Nathan Aké; Manuel Akanji; Rodri; Bernardo Silva; Jack Grealish; Kyle Walker; Ilkay Gündogan; Riyad Mahrez; Erling Haaland,NULL,19,7,12,7,4,3,Gvardiol 70'; Mahrez 27',NULL,45'' Benjamin Henrichs x Lukas Klostermann; 66'' Christopher Nkunku x Emil Forsberg; 82'' Amadou Haidara x Xaver Schlager; 82'' Yussuf Poulsen x André Silva; 89'' David Raum x Marcel Halstenberg,Benjamin Henrichs 90'',NULL,38%,62%,18,12,6,6,2,4
