season,fase,instancia,fecha,hora_inicio,hora_fin,local,visitante,marcador,global,estadio,ciudad,pais,arbitro_principal,arbitros_linea,entrenador_local,entrenador_visitante,planteles,puntuaciones_jugadores,tiros_totales,tiros_totales_local,tiros_totales_visitante,tiros_puerta,tiros_puerta_local,tiros_puerta_visitante,goles,asistencias,cambios,amarillas,rojas,posesion_local,posesion_visitante,faltas_total,faltas_local,faltas_visitante,corners_total,corners_local,corners_visitante
2017-2018,Semifinal,Ida,25-04-2018,18:45,20:45,Bayern Munich,Real Madrid,1-2,3-4,Allianz Arena,Munich,Alemania,Björn Kuipers,Sander van Roekel; Erwin Zeinstra,Jupp Heynckes,Zinedine Zidane,Bayern Munich: Sven Ulreich; Mats Hummels; Jérôme Boateng; Javi Martínez; Rafinha; Joshua Kimmich; James Rodríguez; Thomas Müller; Franck Ribéry; Arjen Robben; Robert Lewandowski | Real Madrid: Keylor Navas; Sergio Ramos; Raphaël Varane; Casemiro; Marcelo; Dani Carvajal; Toni Kroos; Luka Modric; Isco; Lucas Vázquez; Cristiano Ronaldo,NULL,24,17,7,9,5,4,Kimmich 28'; Marcelo 44'; Asensio 57',NULL,8'' Thiago Alcantara x Arjen Robben; 34'' Niklas Süle x Jérôme Boateng; 45'' Marco Asensio x Isco; 67'' Karim Benzema x Dani Carvajal; 75'' Corentin Tolisso x Javi Martínez; 83'' Mateo Kovacic x Casemiro,Franck Ribéry 52''; Casemiro 78''; Thiago Alcantara 89'',NULL,60%,40%,22,8,14,13,10,3
2017-2018,Semifinal,Vuelta,01-05-2018,18:45,20:45,Real Madrid,Bayern Munich,2-2,4-3,Santiago Bernabeu,Madrid,España,Cüneyt Çakır,Bahattin Duran; Tarik Ongun,Zinedine Zidane,Jupp Heynckes,Real Madrid: Keylor Navas; Sergio Ramos; Raphaël Varane; Marcelo; Lucas Vázquez; Toni Kroos; Mateo Kovacic; Marco Asensio; Luka Modric; Cristiano Ronaldo; Karim Benzema | Bayern Munich: Sven Ulreich; Mats Hummels; Niklas Süle; Thiago Alcantara; David Alaba; Joshua Kimmich; James Rodríguez; Corentin Tolisso; Franck Ribéry; Thomas Müller; Robert Lewandowski,NULL,31,9,22,13,3,10,Benzema 11'; 46'; Kimmich 3'; James 63',NULL,72'' Gareth Bale x Karim Benzema; 73'' Casemiro x Mateo Kovacic; 75'' Sandro Wagner x Corentin Tolisso; 84'' Javi Martínez x James Rodríguez; 88'' Nacho x Marco Asensio,Luka Modric 62''; Lucas Vázquez 65''; Raphaël Varane 88''; Casemiro 89'',NULL,40%,60%,20,10,10,17,6,11
2017-2018,Final,Final,26-05-2018,18:45,20:45,Real Madrid,Liverpool,3-1,NULL,NSC Olimpiyskiy,Kiev,Ucrania,Milorad Mažić,Dalibor Djurdjević; Milovan Ristić,Zinedine Zidane,Jurgen Klopp,Real Madrid: Keylor Navas; Sergio Ramos; Raphaël Varane; Marcelo; Dani Carvajal; Cristiano Ronaldo; Casemiro; Isco; Toni Kroos; Luka Modric; Karim Benzema | Liverpool: Loris Karius; Virgil van Dijk; Dejan Lovren; Andrew Robertson; Trent Alexander-Arnold; Jordan Henderson; James Milner; Georginio Wijnaldum; Sadio Mané; Mohamed Salah; Roberto Firmino,NULL,27,14,13,7,5,2,Benzema 51'; Bale 64'; 83'; Mane 55',NULL,30'' Adam Lallana x Mohamed Salah; 37'' Nacho x Dani Carvajal; 61'' Gareth Bale x Isco; 83'' Emre Can x James Milner; 89'' Marco Asensio x Karim Benzema,Sadio Mané 82'',NULL,66%,34%,23,5,18,14,9,5
2018-2019,Octavos,Ida,12-02-2019,17:00,19:00,Manchester United,PSG,0-2,3-3,Old Trafford,Manchester,Inglaterra,NULL,Fabiano Preti; Alessandro Costanzo,Ole Gunnar Solskjaer,Thomas Tuchel,New England Revolution: Brad Knighton; Jalil Anibaba; Antonio Dalamea Milnar; Edgar Castillo; Brandon Bye; Wilfried Zahibo; Scott Caldwell; Cristian Penilla; Teal Bunbury; Carles Gil; Juan Agudelo | FC Dallas: Jesse Gonzalez; Reto Ziegler; Matt Hedges; Ryan Hollingshead; Reggie Cannon; Carlos Gruezo; Jacori Hayes; Bryan Acosta; Hárold Mosquera; Michael Barrios; Dominique Badji,NULL,18,9,9,5,2,3,Kimpembe 53'; Mbappe 60',NULL,73'' Paxton Pomykal x Jacori Hayes; 77'' Diego Fagundez x Juan Agudelo; 81'' Jesús Ferreira x Hárold Mosquera; 90'+1'' Luis Caicedo x Scott Caldwell,Wilfried Zahibo 19''; Reto Ziegler 56''; Antonio Dalamea Milnar 70''; Dominique Badji 71'',Paul Pogba 89'',32%,68%,40,24,16,4,1,3
2018-2019,Octavos,Vuelta,06-03-2019,17:00,19:00,PSG,Manchester United,1-3,3-3,Parc des Princes,Paris,Francia,NULL,Jure Praprotnik; Robert Vukan,Thomas Tuchel,Ole Gunnar Solskjaer,Manchester United: David de Gea; Victor Lindelöf; Chris Smalling; Luke Shaw; Eric Bailly; Fred ; Scott McTominay; Andreas Pereira; Ashley Young; Marcus Rashford; Romelu Lukaku | Paris Saint-Germain: Gianluigi Buffon; Thiago Silva; Presnel Kimpembe; Thilo Kehrer; Marco Verratti; Marquinhos; Juan Bernat; Dani Alves; Ángel Di María; Julian Draxler; Kylian Mbappé,NULL,17,5,12,8,4,4,Bernat 12'; Lukaku 2'; 30'; Rashford 94',NULL,36'' Diogo Dalot x Eric Bailly; 70'' Leandro Paredes x Thilo Kehrer; 70'' Thomas Meunier x Julian Draxler; 80'' Tahith Chong x Andreas Pereira; 87'' Mason Greenwood x Ashley Young; 90'+5'' Edinson Cavani x Dani Alves,Ángel Di María 34''; Leandro Paredes 75''; Marquinhos 90'+4''; Luke Shaw 90'+9'',Marcus Rashford 90'+4'',28%,72%,24,15,9,4,0,4
2018-2019,Octavos,Ida,12-02-2019,20:00,22:00,Roma,Porto,2-1,3-4,Stadio Olimpico,Roma,Italia,Danny Makkelie,Mario Diks; Hessel Steegstra,Eusebio Di Francesco,Sergio Conceicao,AS Roma: Antonio Mirante; Federico Fazio; Kostas Manolas; Aleksandar Kolarov; Alessandro Florenzi; Daniele De Rossi; Lorenzo Pellegrini; Bryan Cristante; Stephan El Shaarawy; Nicolò Zaniolo; Edin Dzeko | FC Porto: Iker Casillas; Pepe; Felipe; Alex Telles; Éder Militão; Héctor Herrera; Danilo Pereira; Yacine Brahimi; Otávio; Fernando; Tiquinho Soares,NULL,21,14,7,11,9,2,Zaniolo 70'; 76'; Adrian Lopez 79',NULL,68'' Adrián x Yacine Brahimi; 76'' André Pereira x Fernando; 83'' Steven N'Zonzi x Lorenzo Pellegrini; 84'' Hernâni  x Otávio; 87'' Davide Santon x Nicolò Zaniolo; 90'' Justin Kluivert x Stephan El Shaarawy,Héctor Herrera 74''; Stephan El Shaarawy 88'',Darwin Quintero 37'',43%,57%,24,11,13,3,2,1
2018-2019,Octavos,Vuelta,06-03-2019,20:00,22:00,Porto,Roma,3-1,4-3,Estadio do Dragao,Porto,Portugal,Cüneyt Çakır,Bahattin Duran; Tarik Ongun,Sergio Conceicao,Eusebio Di Francesco,FC Porto: Iker Casillas; Pepe; Felipe; Alex Telles; Éder Militão; Danilo Pereira; Héctor Herrera; Jesús Corona; Otávio; Tiquinho Soares; Moussa Marega | AS Roma: Robin Olsen; Juan Jesus; Iván Marcano; Kostas Manolas; Steven N'Zonzi; Daniele De Rossi; Aleksandar Kolarov; Rick Karsdorp; Diego Perotti; Nicolò Zaniolo; Edin Dzeko,NULL,46,31,15,11,9,2,Tiquinho 26'; Marega 52'; Alex Telles 117'; De Rossi 37',NULL,45'+4'' Lorenzo Pellegrini x Daniele De Rossi; 55'' Alessandro Florenzi x Rick Karsdorp; 69'' Yacine Brahimi x Jesús Corona; 76'' Bryan Cristante x Iván Marcano; 78'' Fernando x Tiquinho Soares; 94'' Hernâni  x Otávio; 96'' Patrik Schick x Lorenzo Pellegrini; 103'' Maxi Pereira x Éder Militão,Nicolò Zaniolo 15''; Héctor Herrera 18''; Danilo Pereira 45'+2''; Rick Karsdorp 55''; Pepe 58''; Edin Dzeko 58''; Lorenzo Pellegrini 81''; Alessandro Florenzi 116''; Alex Telles 118'',Daniele De Rossi 37''; Alex Telles 117'',59%,41%,39,19,20,18,10,8
2018-2019,Octavos,Ida,13-02-2019,20:00,22:00,Ajax,Real Madrid,1-2,3-5,Johan Cruyff Arena,Amsterdam,Paises Bajos,Damir Skomina,Jure Praprotnik; Robert Vukan,Erik ten Hag,Santiago Solari,Ajax Amsterdam: André Onana; Daley Blind; Matthijs de Ligt; Nicolás Tagliafico; Noussair Mazraoui; Donny van de Beek; Frenkie de Jong; Lasse Schöne; David Neres; Hakim Ziyech; Dusan Tadic | Real Madrid: Thibaut Courtois; Sergio Ramos; Nacho; Sergio Reguilón; Dani Carvajal; Casemiro; Toni Kroos; Luka Modric; Vinícius Júnior; Gareth Bale; Karim Benzema,NULL,32,19,13,15,7,8,Ziyech 75'; Benzema 60'; Asensio 87',NULL,61'' Lucas Vázquez x Gareth Bale; 73'' Kasper Dolberg x Lasse Schöne; 73'' Marco Asensio x Karim Benzema; 81'' Mariano x Vinícius Júnior,Hakim Ziyech 53''; Sergio Reguilón 69''; Lucas Vázquez 83''; Sergio Ramos 89'',Axel Sjöberg 27'',50%,50%,21,10,11,5,3,2
2018-2019,Octavos,Vuelta,05-03-2019,20:00,22:00,Real Madrid,Ajax,1-4,3-5,Santiago Bernabeu,Madrid,España,Felix Brych,Stefan Lupp; Mark Borsch,Santiago Solari,Erik ten Hag,Real Madrid: Thibaut Courtois; Nacho; Raphaël Varane; Sergio Reguilón; Dani Carvajal; Casemiro; Luka Modric; Toni Kroos; Vinícius Júnior; Lucas Vázquez; Karim Benzema | Ajax Amsterdam: André Onana; Daley Blind; Matthijs de Ligt; Nicolás Tagliafico; Noussair Mazraoui; Donny van de Beek; Frenkie de Jong; Lasse Schöne; David Neres; Hakim Ziyech; Dusan Tadic,NULL,36,20,16,16,8,8,Asensio 70'; Ziyech 7'; Neres 18'; Tadic 62'; Schone 72',NULL,29'' Gareth Bale x Lucas Vázquez; 35'' Marco Asensio x Vinícius Júnior; 73'' Dani de Wit x Lasse Schöne; 74'' Kasper Dolberg x David Neres; 81'' Joël Veltman x Noussair Mazraoui; 87'' Federico Valverde x Casemiro,Noussair Mazraoui 26''; Dani Carvajal 30''; Nacho 90'+3'',Nacho 90'+3'',57%,43%,23,12,11,9,6,3
2018-2019,Octavos,Ida,13-02-2019,20:00,22:00,Tottenham,Borussia Dortmund,3-0,4-0,Wembley,Londres,Inglaterra,Antonio Mateu Lahoz,Roberto del Palomar; Pau Cebrián Devís,Mauricio Pochettino,Lucien Favre,Tottenham Hotspur: Hugo Lloris; Davinson Sánchez; Toby Alderweireld; Juan Foyth; Harry Winks; Moussa Sissoko; Christian Eriksen; Jan Vertonghen; Sèrge Aurier; Lucas Moura; Son Heung-Min | Borussia Dortmund: Roman Bürki; Dan-Axel Zagadou; Ömer Toprak; Abdou Diallo; Achraf Hakimi; Axel Witsel; Thomas Delaney; Mahmoud Dahoud; Christian Pulisic; Jadon Sancho; Mario Götze,NULL,21,15,6,10,5,5,Son 47'; Vertonghen 83'; Llorente 86',NULL,77'' Marcel Schmelzer x Dan-Axel Zagadou; 84'' Fernando Llorente x Lucas Moura; 88'' Jacob Bruun Larsen x Christian Pulisic; 88'' Raphaël Guerreiro x Jadon Sancho; 90'' Erik Lamela x Son Heung-Min; 90'+1'' Victor Wanyama x Moussa Sissoko,Sèrge Aurier 12''; Thomas Delaney 53'',NULL,53%,47%,18,13,5,7,6,1
2018-2019,Octavos,Vuelta,05-03-2019,20:00,22:00,Borussia Dortmund,Tottenham,0-1,0-4,Signal Iduna Park,Dortmund,Alemania,Danny Makkelie,Mario Diks; Hessel Steegstra,Lucien Favre,Mauricio Pochettino,Borussia Dortmund: Roman Bürki; Manuel Akanji; Julian Weigl; Axel Witsel; Abdou Diallo; Marius Wolf; Marco Reus; Mario Götze; Raphaël Guerreiro; Jadon Sancho; Paco Alcácer | Tottenham Hotspur: Hugo Lloris; Davinson Sánchez; Jan Vertonghen; Toby Alderweireld; Christian Eriksen; Moussa Sissoko; Harry Winks; Ben Davies; Sèrge Aurier; Son Heung-Min; Harry Kane,NULL,24,19,5,8,7,1,Kane 49',NULL,55'' Eric Dier x Harry Winks; 62'' Christian Pulisic x Raphaël Guerreiro; 62'' Jacob Bruun Larsen x Marius Wolf; 71'' Erik Lamela x Son Heung-Min; 74'' Thomas Delaney x Marco Reus; 83'' Danny Rose x Christian Eriksen,NULL,NULL,64%,36%,7,4,3,15,10,5
2018-2019,Octavos,Ida,19-02-2019,20:00,22:00,Lyon,Barcelona,0-0,1-5,Groupama Stadium,Lyon,Francia,Cüneyt Çakır,Bahattin Duran; Tarik Ongun,Bruno Genesio,Ernesto Valverde,Lyon: Anthony Lopes; Jason Denayer; Marcelo; Ferland Mendy; Léo Dubois; Tanguy Ndombele; Houssem Aouar; Martin Terrier; Bertrand Traoré; Moussa Dembélé; Memphis Depay | Barcelona: Marc-André ter Stegen; Clément Lenglet; Gerard Piqué; Jordi Alba; Nélson Semedo; Sergio Busquets; Ivan Rakitić; Sergi Roberto; Ousmane Dembélé; Lionel Messi; Luis Suárez,NULL,30,5,25,7,2,5,Andreas Ivan 6''; Gaston Sauro 41'',NULL,67'' Philippe Coutinho x Ousmane Dembélé; 69'' Lucas Tousart x Bertrand Traoré; 76'' Maxwel Cornet x Martin Terrier; 81'' Arturo Vidal x Sergi Roberto; 84'' Pape Diop x Tanguy Ndombele,Houssem Aouar 3''; Léo Dubois 33''; Sergi Roberto 80''; Nélson Semedo 88'',NULL,37%,63%,24,13,11,8,2,6
2018-2019,Octavos,Vuelta,13-03-2019,20:00,22:00,Barcelona,Lyon,5-1,5-1,Camp Nou,Barcelona,España,Szymon Marciniak,Paweł Sokolnicki; Tomasz Listkiewicz,Ernesto Valverde,Bruno Genesio,Barcelona: Marc-André ter Stegen; Clément Lenglet; Gerard Piqué; Jordi Alba; Sergi Roberto; Sergio Busquets; Arthur; Ivan Rakitić; Philippe Coutinho; Lionel Messi; Luis Suárez | Lyon: Anthony Lopes; Marcelo; Fernando Marçal; Jason Denayer; Tanguy Ndombele; Lucas Tousart; Nabil Fekir; Ferland Mendy; Léo Dubois; Memphis Depay; Moussa Dembélé,NULL,30,19,11,12,10,2,Messi 17'; 78'; Coutinho 31'; Pique 81'; Dembele 86'; Tousart 58',NULL,34'' Mathieu Gorgelin x Anthony Lopes; 70'' Ousmane Dembélé x Philippe Coutinho; 73'' Bertrand Traoré x Memphis Depay; 74'' Arturo Vidal x Arthur; 77'' Maxwel Cornet x Ferland Mendy; 83'' Nélson Semedo x Sergi Roberto,Fernando Marçal 33''; Moussa Dembélé 45'+4''; Clément Lenglet 49'',Lionel Messi 17'',55%,45%,29,11,18,12,6,6
2018-2019,Octavos,Ida,19-02-2019,20:00,22:00,Liverpool,Bayern Munich,0-0,3-1,Anfield,Liverpool,Inglaterra,Gianluca Rocchi,Filippo Meli; Matteo Passeri,Jurgen Klopp,Niko Kovac,Liverpool: Alisson Becker; Fabinho; Joël Matip; Andrew Robertson; Trent Alexander-Arnold; Jordan Henderson; Naby Keïta; Georginio Wijnaldum; Sadio Mané; Mohamed Salah; Roberto Firmino | Bayern Munich: Manuel Neuer; Mats Hummels; Niklas Süle; David Alaba; Joshua Kimmich; James Rodríguez; Thiago Alcantara; Javi Martínez; Kingsley Coman; Serge Gnabry; Robert Lewandowski,NULL,24,15,9,2,2,0,NULL,NULL,76'' James Milner x Naby Keïta; 76'' Divock Origi x Roberto Firmino; 81'' Franck Ribéry x Kingsley Coman; 88'' Renato Sanches x James Rodríguez; 90'+1'' Rafinha x Serge Gnabry,Joshua Kimmich 28''; Jordan Henderson 55'',NULL,49%,51%,23,10,13,11,5,6
2018-2019,Octavos,Vuelta,13-03-2019,20:00,22:00,Bayern Munich,Liverpool,1-3,1-3,Allianz Arena,Munich,Alemania,Daniele Orsato,Lorenzo Manganelli; Fabiano Preti,Niko Kovac,Jurgen Klopp,Bayern Munich: Manuel Neuer; Mats Hummels; Niklas Süle; David Alaba; Rafinha; James Rodríguez; Thiago Alcantara; Javi Martínez; Franck Ribéry; Serge Gnabry; Robert Lewandowski | Liverpool: Alisson Becker; Virgil van Dijk; Joël Matip; Andrew Robertson; Trent Alexander-Arnold; Jordan Henderson; James Milner; Georginio Wijnaldum; Mohamed Salah; Sadio Mané; Roberto Firmino,NULL,17,7,10,8,2,6,Mane 26'; 84'; Van Dijk 69'; Matip OG 39',NULL,13'' Fabinho x Jordan Henderson; 61'' Kingsley Coman x Franck Ribéry; 72'' Leon Goretzka x Javi Martínez; 79'' Renato Sanches x James Rodríguez; 83'' Divock Origi x Roberto Firmino; 87'' Adam Lallana x James Milner,Fabinho 43''; Joël Matip 63''; Thiago Alcantara 65''; Renato Sanches 83''; Andrew Robertson 90'+2'',NULL,58%,42%,21,7,14,9,2,7
2018-2019,Octavos,Ida,20-02-2019,20:00,22:00,Atletico Madrid,Juventus,2-0,2-3,Wanda Metropolitano,Madrid,España,Felix Zwayer,Thorsten Schiffner; Marco Achmüller,Diego Simeone,Massimiliano Allegri,Atlético Madrid: Jan Oblak; Diego Godín; José María Giménez; Filipe Luís; Juanfran; Thomas Partey; Rodri; Koke; Saúl Ñíguez; Diego Costa; Antoine Griezmann | Juventus: Wojciech Szczesny; Giorgio Chiellini; Leonardo Bonucci; Alex Sandro; Mattia De Sciglio; Miralem Pjanic; Blaise Matuidi; Rodrigo Bentancur; Cristiano Ronaldo; Paulo Dybala; Mario Mandzukic,NULL,27,13,14,7,5,2,Gimenez 78'; Godin 83',NULL,58'' Álvaro Morata x Diego Costa; 61'' Thomas Lemar x Thomas Partey; 67'' Ángel Correa x Koke; 73'' Emre Can x Miralem Pjanic; 80'' Federico Bernardeschi x Paulo Dybala; 84'' João Cancelo x Blaise Matuidi,Diego Costa 8''; Thomas Partey 45'+3''; Alex Sandro 55''; Antoine Griezmann 89'',NULL,37%,63%,28,12,16,15,8,7
2018-2019,Octavos,Vuelta,12-03-2019,20:00,22:00,Juventus,Atletico Madrid,3-0,3-2,Juventus Stadium,Turin,Italia,Björn Kuipers,Sander van Roekel; Erwin Zeinstra,Massimiliano Allegri,Diego Simeone,Juventus: Wojciech Szczesny; Leonardo Bonucci; Giorgio Chiellini; Emre Can; Miralem Pjanic; Blaise Matuidi; Federico Bernardeschi; Leonardo Spinazzola; João Cancelo; Mario Mandzukic; Cristiano Ronaldo | Atlético Madrid: Jan Oblak; Diego Godín; José María Giménez; Juanfran; Santiago Arias; Saúl Ñíguez; Rodri; Thomas Lemar; Koke; Álvaro Morata; Antoine Griezmann,NULL,21,16,5,4,4,0,Ronaldo 27'; 48'; 86',NULL,57'' Ángel Correa x Thomas Lemar; 67'' Paulo Dybala x Leonardo Spinazzola; 77'' Vitolo x Santiago Arias; 80'' Moise Kean x Mario Mandzukic,Federico Bernardeschi 64''; Juanfran 73''; José María Giménez 86''; Vitolo 90'+1'',Cristiano Ronaldo 86'',62%,38%,29,12,17,5,5,0
2018-2019,Octavos,Ida,20-02-2019,20:00,22:00,Schalke 04,Manchester City,2-3,3-10,Veltins-Arena,Gelsenkirchen,Alemania,Carlos del Cerro Grande,Juan Carlos Yuste; Roberto Alonso Fernández,Domenico Tedesco,Pep Guardiola,Schalke 04: Ralf Fährmann; Salif Sané; Matija Nastasic; Jeffrey Bruma; Bastian Oczipka; Daniel Caligiuri; Nabil Bentaleb; Suat Serdar; Hamza Mendyl; Weston McKennie; Mark Uth | Manchester City: Ederson ; Nicolás Otamendi; Fernandinho; Aymeric Laporte; Kyle Walker; Ilkay Gündogan; David Silva; Kevin De Bruyne; Raheem Sterling; Bernardo Silva; Sergio Agüero,NULL,28,7,21,8,2,6,Bentaleb 38'; 45'; Aguero 18'; Sane 85'; Sterling 90',NULL,65'' Guido Burgstaller x Hamza Mendyl; 70'' Vincent Kompany x David Silva; 78'' Steven Skrzybski x Weston McKennie; 78'' Leroy Sané x Sergio Agüero; 87'' Oleksandr Zinchenko x Kevin De Bruyne; 87'' Amine Harit x Mark Uth,Nicolás Otamendi 36''; Mark Uth 41''; Fernandinho 43''; Salif Sané 73''; Guido Burgstaller 90'+5''; Ederson  90'+5'',Nabil Bentaleb 38''; Nabil Bentaleb 45''; Nicolás Otamendi 68'',34%,66%,20,11,9,11,2,9
2018-2019,Octavos,Vuelta,12-03-2019,20:00,22:00,Manchester City,Schalke 04,7-0,10-2,Etihad Stadium,Manchester,Inglaterra,Clément Turpin,Cyril Gringore; Nicolas Danos,Pep Guardiola,Domenico Tedesco,Manchester City: Ederson ; Aymeric Laporte; Danilo; Oleksandr Zinchenko; Kyle Walker; Ilkay Gündogan; David Silva; Bernardo Silva; Leroy Sané; Raheem Sterling; Sergio Agüero | Schalke 04: Ralf Fährmann; Salif Sané; Jeffrey Bruma; Benjamin Stambouli; Bastian Oczipka; Weston McKennie; Nabil Bentaleb; Suat Serdar; Yevhen Konoplyanka; Breel Embolo; Guido Burgstaller,NULL,17,15,2,12,11,1,Aguero 35'; 38'; Sane 42'; Sterling 56'; Silva 71'; Foden 78'; Jesus 84',NULL,64'' Phil Foden x David Silva; 64'' Gabriel Jesus x Sergio Agüero; 69'' Steven Skrzybski x Breel Embolo; 72'' Fabian Delph x Aymeric Laporte; 74'' Hamza Mendyl x Weston McKennie; 79'' Cedric Teuchert x Guido Burgstaller,Jeffrey Bruma 33''; Danilo 48''; Oleksandr Zinchenko 69'',Sergio Agüero 35'',72%,28%,17,10,7,4,3,1
2018-2019,Cuartos,Ida,09-04-2019,19:00,21:00,Liverpool,Porto,2-0,6-1,Anfield,Liverpool,Inglaterra,Antonio Mateu Lahoz,Pau Cebrián Devís; Roberto del Palomar,Jurgen Klopp,Sergio Conceicao,Liverpool: Alisson Becker; Virgil van Dijk; Dejan Lovren; James Milner; Trent Alexander-Arnold; Fabinho; Naby Keïta; Jordan Henderson; Sadio Mané; Mohamed Salah; Roberto Firmino | FC Porto: Iker Casillas; Felipe; Éder Militão; Maxi Pereira; Óliver Torres; Danilo Pereira; Alex Telles; Jesús Corona; Moussa Marega; Otávio; Tiquinho Soares,NULL,23,15,8,6,3,3,Keita 5'; Firmino 26',NULL,62'' Yacine Brahimi x Tiquinho Soares; 73'' Divock Origi x Sadio Mané; 73'' Bruno Costa x Óliver Torres; 77'' Fernando x Maxi Pereira; 82'' Daniel Sturridge x Roberto Firmino,Tiquinho Soares 17''; Felipe 61'',NULL,64%,36%,16,9,7,9,4,5
2018-2019,Cuartos,Vuelta,17-04-2019,19:00,21:00,Porto,Liverpool,1-4,1-6,Estadio do Dragao,Porto,Portugal,Danny Makkelie,Hessel Steegstra; Mario Diks,Sergio Conceicao,Jurgen Klopp,FC Porto: Iker Casillas; Pepe; Felipe; Alex Telles; Éder Militão; Danilo Pereira; Héctor Herrera; Jesús Corona; Moussa Marega; Yacine Brahimi; Otávio | Liverpool: Alisson Becker; Virgil van Dijk; Joël Matip; Andrew Robertson; Trent Alexander-Arnold; Fabinho; James Milner; Georginio Wijnaldum; Divock Origi; Mohamed Salah; Sadio Mané,NULL,32,19,13,13,8,5,Mane 26'; Salah 65'; Firmino 77'; Van Dijk 84'; Militao 69',NULL,45'' Roberto Firmino x Divock Origi; 45'' Tiquinho Soares x Otávio; 66'' Joe Gomez x Trent Alexander-Arnold; 71'' Jordan Henderson x Andrew Robertson; 78'' Fernando x Jesús Corona; 81'' Bruno Costa x Yacine Brahimi,Sadio Mané 32''; Pepe 36'',NULL,51%,49%,29,16,13,9,6,3
2018-2019,Cuartos,Ida,09-04-2019,19:00,21:00,Tottenham,Manchester City,1-0,4-4,Tottenham Hotspur Stadium,Londres,Inglaterra,Björn Kuipers,Sander van Roekel; Erwin Zeinstra,Mauricio Pochettino,Pep Guardiola,Tottenham Hotspur: Hugo Lloris; Jan Vertonghen; Toby Alderweireld; Danny Rose; Kieran Trippier; Dele Alli; Harry Winks; Moussa Sissoko; Son Heung-Min; Christian Eriksen; Harry Kane | Manchester City: Ederson ; Aymeric Laporte; Nicolás Otamendi; Fabian Delph; Kyle Walker; David Silva; Ilkay Gündogan; Fernandinho; Raheem Sterling; Riyad Mahrez; Sergio Agüero,NULL,23,13,10,6,4,2,Son 78',NULL,58'' Lucas Moura x Harry Kane; 71'' Gabriel Jesus x Sergio Agüero; 81'' Victor Wanyama x Harry Winks; 87'' Fernando Llorente x Dele Alli; 89'' Leroy Sané x Riyad Mahrez; 89'' Kevin De Bruyne x David Silva,Danny Rose 12''; Aymeric Laporte 28''; Riyad Mahrez 59'',NULL,41%,59%,19,8,11,6,3,3
2018-2019,Cuartos,Vuelta,17-04-2019,19:00,21:00,Manchester City,Tottenham,4-3,4-4,Etihad Stadium,Manchester,Inglaterra,Cüneyt Çakır,Bahattin Duran; Tarik Ongun,Pep Guardiola,Mauricio Pochettino,Manchester City: Ederson ; Aymeric Laporte; Vincent Kompany; Benjamin Mendy; Kyle Walker; Ilkay Gündogan; David Silva; Kevin De Bruyne; Raheem Sterling; Bernardo Silva; Sergio Agüero | Tottenham Hotspur: Hugo Lloris; Jan Vertonghen; Toby Alderweireld; Victor Wanyama; Danny Rose; Kieran Trippier; Christian Eriksen; Dele Alli; Moussa Sissoko; Lucas Moura; Son Heung-Min,NULL,31,20,11,15,8,7,Sterling 4'; 21'; Aguero 59'; Bernardo Silva 11'; Son 7'; 10'; Llorente 73',NULL,41'' Fernando Llorente x Moussa Sissoko; 63'' Fernandinho x David Silva; 82'' Ben Davies x Lucas Moura; 84'' Leroy Sané x Benjamin Mendy; 90'+1'' Davinson Sánchez x Danny Rose,Moussa Sissoko 41''; Son Heung-Min 48''; Danny Rose 54''; Victor Wanyama 77'',NULL,66%,34%,20,8,12,7,4,3
2018-2019,Cuartos,Ida,10-04-2019,19:00,21:00,Ajax,Juventus,1-1,3-2,Johan Cruyff Arena,Amsterdam,Paises Bajos,Carlos del Cerro Grande,Roberto Alonso Fernández; Juan Carlos Yuste,Erik ten Hag,Massimiliano Allegri,Ajax Amsterdam: André Onana; Daley Blind; Matthijs de Ligt; Nicolás Tagliafico; Joël Veltman; Donny van de Beek; Frenkie de Jong; Lasse Schöne; David Neres; Hakim Ziyech; Dusan Tadic | Juventus: Wojciech Szczesny; Leonardo Bonucci; Daniele Rugani; Alex Sandro; João Cancelo; Miralem Pjanic; Blaise Matuidi; Rodrigo Bentancur; Cristiano Ronaldo; Federico Bernardeschi; Mario Mandzukic,NULL,26,19,7,7,6,1,Neres 46'; Ronaldo 45',NULL,60'' Douglas Costa x Mario Mandzukic; 75'' Paulo Dybala x Blaise Matuidi; 75'' Jurgen Ekkelenkamp x Lasse Schöne; 90'+3'' Sami Khedira x Federico Bernardeschi,Nicolás Tagliafico 41''; Frenkie de Jong 55''; Lasse Schöne 71''; Miralem Pjanic 83''; Jurgen Ekkelenkamp 90'+4'',NULL,61%,39%,25,15,10,7,4,3
2018-2019,Cuartos,Vuelta,16-04-2019,19:00,21:00,Juventus,Ajax,1-2,2-3,Juventus Stadium,Turin,Italia,Clément Turpin,Nicolas Danos; Cyril Gringore,Massimiliano Allegri,Erik ten Hag,Juventus: Wojciech Szczesny; Daniele Rugani; Leonardo Bonucci; Alex Sandro; Mattia De Sciglio; Miralem Pjanic; Emre Can; Blaise Matuidi; Federico Bernardeschi; Cristiano Ronaldo; Paulo Dybala | Ajax Amsterdam: André Onana; Daley Blind; Matthijs de Ligt; Noussair Mazraoui; Joël Veltman; Donny van de Beek; Frenkie de Jong; Lasse Schöne; David Neres; Hakim Ziyech; Dusan Tadic,NULL,27,13,14,7,3,4,Ronaldo 28'; Van de Beek 34'; De Ligt 67',NULL,11'' Daley Sinkgraven x Noussair Mazraoui; 45'' Moise Kean x Paulo Dybala; 64'' João Cancelo x Mattia De Sciglio; 80'' Rodrigo Bentancur x Federico Bernardeschi; 82'' Lisandro Magallán x Daley Sinkgraven; 88'' Klaas-Jan Huntelaar x Hakim Ziyech,Emre Can 69''; Cristiano Ronaldo 90'+3'',NULL,51%,49%,26,14,12,9,4,5
2018-2019,Cuartos,Ida,10-04-2019,19:00,21:00,Manchester United,Barcelona,0-1,0-4,Old Trafford,Manchester,Inglaterra,NULL,Filippo Meli; Matteo Passeri,Ole Gunnar Solskjaer,Ernesto Valverde,Manchester United: David de Gea; Chris Smalling; Luke Shaw; Victor Lindelöf; Paul Pogba; Scott McTominay; Fred ; Diogo Dalot; Ashley Young; Romelu Lukaku; Marcus Rashford | Barcelona: Marc-André ter Stegen; Clément Lenglet; Gerard Piqué; Jordi Alba; Nélson Semedo; Sergio Busquets; Arthur; Ivan Rakitić; Philippe Coutinho; Lionel Messi; Luis Suárez,NULL,16,10,6,3,0,3,Shaw OG 12',NULL,65'' Arturo Vidal x Philippe Coutinho; 66'' Sergi Roberto x Arthur; 68'' Anthony Martial x Romelu Lukaku; 74'' Jesse Lingard x Diogo Dalot; 85'' Andreas Pereira x Marcus Rashford; 90'+3'' Carles Aleñá x Sergio Busquets,Sergio Busquets 17''; Luke Shaw 19''; Arturo Vidal 71''; Jesse Lingard 76''; Chris Smalling 85'',NULL,34%,66%,27,16,11,6,2,4
2018-2019,Cuartos,Vuelta,16-04-2019,19:00,21:00,Barcelona,Manchester United,3-0,4-0,Camp Nou,Barcelona,España,NULL,Mark Borsch; Stefan Lupp,Ernesto Valverde,Ole Gunnar Solskjaer,Barcelona: Marc-André ter Stegen; Clément Lenglet; Gerard Piqué; Jordi Alba; Sergi Roberto; Sergio Busquets; Arthur; Ivan Rakitić; Philippe Coutinho; Lionel Messi; Luis Suárez | Manchester United: David de Gea; Phil Jones; Chris Smalling; Ashley Young; Victor Lindelöf; Anthony Martial; Fred ; Jesse Lingard; Paul Pogba; Scott McTominay; Marcus Rashford,NULL,22,13,9,9,6,3,Messi 16'; 20'; Coutinho 61',NULL,65'' Diogo Dalot x Anthony Martial; 71'' Nélson Semedo x Sergi Roberto; 73'' Romelu Lukaku x Marcus Rashford; 75'' Arturo Vidal x Arthur; 80'' Alexis Sánchez x Jesse Lingard; 81'' Ousmane Dembélé x Philippe Coutinho,Luis Suárez 77'',NULL,66%,34%,25,10,15,11,8,3
