season,fase,instancia,fecha,hora_inicio,hora_fin,local,visitante,marcador,global,estadio,ciudad,pais,arbitro_principal,arbitros_linea,entrenador_local,entrenador_visitante,planteles,puntuaciones_jugadores,tiros_totales,tiros_totales_local,tiros_totales_visitante,tiros_puerta,tiros_puerta_local,tiros_puerta_visitante,goles,asistencias,cambios,amarillas,rojas,posesion_local,posesion_visitante,faltas_total,faltas_local,faltas_visitante,corners_total,corners_local,corners_visitante
2014-2015,Octavos,Ida,24-02-2015,19:45,21:45,Bayer Leverkusen,Atletico Madrid,1-0,1-1,BayArena,Leverkusen,Alemania,NULL,Roman Slyško; Martin Wilczek,Roger Schmidt,Diego Simeone,Bayer Leverkusen: Bernd Leno; Emir Spahic; Kyriakos Papadopoulos; Wendell; Roberto Hilbert; Hakan Çalhanoglu; Lars Bender; Gonzalo Castro; Son Heung-Min; Karim Bellarabi; Josip Drmic | Atlético Madrid: Miguel Ángel Moyà; Diego Godín; Miranda; Guilherme Siqueira; Juanfran; Tiago; Gabi; Saúl Ñíguez; Arda Turan; Antoine Griezmann; Mario Mandzukic,NULL,40,21,19,10,5,5,Calhanoglu 57',NULL,38'' Jesús Gámez x Guilherme Siqueira; 42'' Raúl García x Saúl Ñíguez; 64'' Fernando Torres x Arda Turan; 68'' Simon Rolfes x Lars Bender; 80'' Stefan Kiessling x Josip Drmic; 87'' Julian Brandt x Hakan Çalhanoglu,Tiago 22''; Kyriakos Papadopoulos 36''; Wendell 58''; Diego Godín 60''; Lars Bender 62''; Gonzalo Castro 88''; Fernando Torres 89''; Stefan Kiessling 89''; Jesús Gámez 90'+2'',Tiago,65%,34%,36,25,11,13,12,1
2014-2015,Octavos,Vuelta,17-03-2015,19:45,21:45,Atletico Madrid,Bayer Leverkusen,1-0,1-1,Vicente Calderon,Madrid,España,Nicola Rizzoli,Mauro Tonolini; Lorenzo Manganelli,Diego Simeone,Roger Schmidt,Atlético Madrid: Miguel Ángel Moyà; Miranda; José María Giménez; Jesús Gámez; Juanfran; Mario Suárez; Koke; Cani; Arda Turan; Antoine Griezmann; Mario Mandzukic | Bayer Leverkusen: Bernd Leno; Emir Spahic; Ömer Toprak; Wendell; Roberto Hilbert; Lars Bender; Gonzalo Castro; Son Heung-Min; Karim Bellarabi; Hakan Çalhanoglu; Josip Drmic,NULL,36,22,14,15,8,7,Garcia 27',NULL,23'' Jan Oblak x Miguel Ángel Moyà; 45'' Raúl García x Cani; 69'' Stefan Kiessling x Josip Drmic; 77'' Simon Rolfes x Son Heung-Min; 83'' Fernando Torres x Mario Mandzukic; 104'' Kyriakos Papadopoulos x Lars Bender,Emir Spahic 26''; José María Giménez 30''; Ömer Toprak 65''; Jesús Gámez 72''; Mario Suárez 75''; Hakan Çalhanoglu 78''; Wendell 89''; Stefan Kiessling 102''; Fernando Torres 110''; Kyriakos Papadopoulos 113'',NULL,48%,51%,31,8,23,22,6,16
2014-2015,Octavos,Ida,24-02-2015,19:45,21:45,Arsenal,Monaco,1-3,3-3,Emirates Stadium,Londres,Inglaterra,NULL,Guido Kleve; Markus Häcker,Arsene Wenger,Leonardo Jardim,Arsenal: David Ospina; Laurent Koscielny; Per Mertesacker; Kieran Gibbs; Héctor Bellerín; Mesut Özil; Santi Cazorla; Francis Coquelin; Alexis Sánchez; Danny Welbeck; Olivier Giroud | AS Monaco: Danijel Subasic; Aymen Abdennour; Wallace; Elderson Echiéjilé; Almamy Touré; Geoffrey Kondogbia; Fabinho; Anthony Martial; Nabil Dirar; Dimitar Berbatov; João Moutinho,NULL,43,26,17,17,7,10,Oxlade-Chamberlain 90'; Kondogbia 38'; Berbatov 53'; Ferreira Carrasco 90',NULL,60'' Theo Walcott x Olivier Giroud; 68'' Alex Oxlade-Chamberlain x Francis Coquelin; 75'' Yannick Carrasco x Dimitar Berbatov; 81'' Tomas Rosicky x Santi Cazorla; 82'' Layvin Kurzawa x Nabil Dirar; 84'' Bernardo Silva x Anthony Martial,Francis Coquelin 42''; Elderson Echiéjilé 45''; Héctor Bellerín 74''; Mesut Özil 87''; João Moutinho 90'+2'',NULL,57%,42%,22,12,10,10,1,9
2014-2015,Octavos,Vuelta,17-03-2015,19:45,21:45,Monaco,Arsenal,0-2,3-3,Stade Louis II,Monaco,Monaco,Svein Oddvar Moen,Kim Thomas Haglund; Frank Andås,Leonardo Jardim,Arsene Wenger,AS Monaco: Danijel Subasic; Aymen Abdennour; Wallace; Layvin Kurzawa; Fabinho; Geoffrey Kondogbia; Jérémy Toulalan; Anthony Martial; Nabil Dirar; João Moutinho; Dimitar Berbatov | Arsenal: David Ospina; Laurent Koscielny; Per Mertesacker; Nacho Monreal; Héctor Bellerín; Mesut Özil; Santi Cazorla; Francis Coquelin; Danny Welbeck; Alexis Sánchez; Olivier Giroud,NULL,35,5,30,15,1,14,Giroud 36'; Ramsey 79',NULL,60'' Yannick Carrasco x Anthony Martial; 63'' Aaron Ramsey x Francis Coquelin; 70'' Bernardo Silva x Dimitar Berbatov; 72'' Theo Walcott x Danny Welbeck; 83'' Kieran Gibbs x Nacho Monreal; 86'' Elderson Echiéjilé x Nabil Dirar,Alexis Sánchez 42''; Geoffrey Kondogbia 52'',NULL,29%,70%,23,13,10,9,7,2
2014-2015,Octavos,Ida,25-02-2015,19:45,21:45,Shakhtar,Bayern Munich,0-0,0-7,Arena Lviv,Lviv,Ucrania,NULL,Roberto del Palomar; Raúl Cabañero,Mircea Lucescu,Pep Guardiola,Shakhtar Donetsk: Andriy Pyatov; Yaroslav Rakitskiy; Olexandr Kucher; Vyacheslav Shevchuk; Darijo Srna; Fernando; Fred ; Taison; Douglas Costa; Alex Teixeira; Luiz Adriano | Bayern Munich: Manuel Neuer; David Alaba; Jérôme Boateng; Juan Bernat; Rafinha; Xabi Alonso; Bastian Schweinsteiger; Mario Götze; Franck Ribéry; Arjen Robben; Thomas Müller,NULL,17,2,15,3,1,2,NULL,NULL,70'' Holger Badstuber x Thomas Müller; 75'' Robert Lewandowski x Mario Götze; 78'' Marlos x Douglas Costa; 84'' Wellington Nem x Taison; 89'' Olexandr Gladkiy x Luiz Adriano,Rafinha 23''; Xabi Alonso 24''; Darijo Srna 38''; Douglas Costa 58''; Fred  77''; Jérôme Boateng 80''; Bastian Schweinsteiger 84'',Xabi Alonso 65'',36%,63%,34,14,20,7,6,1
2014-2015,Octavos,Vuelta,11-03-2015,19:45,21:45,Bayern Munich,Shakhtar,7-0,7-0,Allianz Arena,Munich,Alemania,William Collum,Graham Chambers; Damien MacGraith,Pep Guardiola,Mircea Lucescu,Bayern Munich: Manuel Neuer; Holger Badstuber; Jérôme Boateng; Bastian Schweinsteiger; David Alaba; Rafinha; Mario Götze; Franck Ribéry; Arjen Robben; Robert Lewandowski; Thomas Müller | Shakhtar Donetsk: Andriy Pyatov; Yaroslav Rakitskiy; Olexandr Kucher; Vyacheslav Shevchuk; Darijo Srna; Alex Teixeira; Taras Stepanenko; Fred ; Taison; Douglas Costa; Luiz Adriano,NULL,48,42,6,24,23,1,Muller 4'; 52'; Boateng 34'; Ribery 49'; Badstuber 63'; Lewandowski 75'; Gotze 87',NULL,9'' Serhiy Kryvtsov x Taison; 19'' Sebastian Rode x Arjen Robben; 59'' Juan Bernat x Franck Ribéry; 67'' Dante x Holger Badstuber; 70'' Ilsinho x Alex Teixeira; 79'' Wellington Nem x Douglas Costa,Holger Badstuber 26''; Douglas Costa 38''; Jérôme Boateng 38'',Olexandr Kucher 3''; Thomas Müller 4'',73%,26%,18,13,5,24,5,19
2014-2015,Octavos,Ida,25-02-2015,19:45,21:45,Schalke 04,Real Madrid,0-2,4-5,Veltins-Arena,Gelsenkirchen,Alemania,NULL,Michael Mullarkey; Stephen Child,Roberto Di Matteo,Carlo Ancelotti,Schalke 04: Timon Wellenreuther; Joël Matip; Matija Nastasic; Benedikt Höwedes; Dennis Aogo; Atsuto Uchida; Roman Neustädter; Kevin-Prince Boateng; Marco Höger; Eric Maxim Choupo-Moting; Klaas-Jan Huntelaar | Real Madrid: Iker Casillas; Raphaël Varane; Pepe; Marcelo; Dani Carvajal; Toni Kroos; Isco; Lucas Silva; Cristiano Ronaldo; Gareth Bale; Karim Benzema,NULL,19,8,11,7,3,4,Ronaldo 26'; Marcelo 79',NULL,33'' Felix Platte x Klaas-Jan Huntelaar; 57'' Jan Kirchhoff x Roman Neustädter; 78'' Javier Hernández x Karim Benzema; 80'' Max Meyer x Marco Höger; 82'' Álvaro Arbeloa x Dani Carvajal; 85'' Asier Illarramendi x Isco,Toni Kroos 9''; Kevin-Prince Boateng 34''; Roman Neustädter 45'+2''; Jan Kirchhoff 63'',NULL,39%,61%,24,15,9,4,2,2
2014-2015,Octavos,Vuelta,10-03-2015,19:45,21:45,Real Madrid,Schalke 04,3-4,5-4,Santiago Bernabeu,Madrid,España,Damir Skomina,Jure Praprotnik; Robert Vukan,Carlo Ancelotti,Roberto Di Matteo,Real Madrid: Iker Casillas; Raphaël Varane; Pepe; Fábio Coentrão; Álvaro Arbeloa; Toni Kroos; Isco; Sami Khedira; Cristiano Ronaldo; Gareth Bale; Karim Benzema | Schalke 04: Timon Wellenreuther; Joël Matip; Matija Nastasic; Benedikt Höwedes; Roman Neustädter; Max Meyer; Marco Höger; Christian Fuchs; Tranquillo Barnetta; Klaas-Jan Huntelaar; Eric Maxim Choupo-Moting,NULL,34,14,20,19,9,10,Ronaldo 25'; 45'; Benzema 52'; Fuchs 20'; Huntelaar 40'; Sane 57'; Huntelaar 84',NULL,29'' Leroy Sané x Eric Maxim Choupo-Moting; 57'' Leon Goretzka x Marco Höger; 58'' Luka Modric x Sami Khedira; 58'' Marcelo x Fábio Coentrão; 81'' Atsuto Uchida x Tranquillo Barnetta; 83'' Nacho x Álvaro Arbeloa,Cristiano Ronaldo 31''; Fábio Coentrão 55''; Roman Neustädter 90'+3'',NULL,48%,52%,11,4,7,12,5,7
2014-2015,Octavos,Ida,18-02-2015,19:45,21:45,Basel,Porto,1-1,1-5,St. Jakob-Park,Basilea,Suiza,Mark Clattenburg,Stuart Burt; Simon Beck,Paulo Sousa,Julen Lopetegui,FC Basel: Tomás Vaclík; Walter Samuel; Marek Suchy; Behrang Safari; Taulant Xhaka; Luca Zuffi; Fabian Frei; Mohamed Elneny; Shkelzen Gashi; Derlis González; Marco Streller | FC Porto: Fabiano; Iván Marcano; Maicon; Alex Sandro; Danilo; Casemiro; Óliver Torres; Héctor Herrera; Yacine Brahimi; Cristian Tello; Jackson Martínez,NULL,16,1,15,8,1,7,Gonzalez 11'; Danilo 79',NULL,25'' Davide Callà x Derlis González; 61'' Ricardo Quaresma x Yacine Brahimi; 63'' Breel Embolo x Marco Streller; 68'' Rúben Neves x Óliver Torres; 81'' Juan Fernando Quintero x Cristian Tello; 83'' Ahmed Mohamed Bekhit Abdelgaber x Shkelzen Gashi,Fabian Frei 21''; Casemiro 29''; Mohamed Elneny 36''; Óliver Torres 36''; Walter Samuel 46''; Alex Sandro 51''; Shkelzen Gashi 57''; Marek Suchy 62''; Danilo 86'',Danilo 79'',37%,63%,34,21,13,9,0,9
2014-2015,Octavos,Vuelta,10-03-2015,19:45,21:45,Porto,Basel,4-0,5-1,Estadio do Dragao,Porto,Portugal,Jonas Eriksson,Mathias Klasenius; Daniel Wärnmark,Julen Lopetegui,Paulo Sousa,FC Porto: Fabiano; Iván Marcano; Maicon; Alex Sandro; Danilo; Casemiro; Evandro Goebel; Héctor Herrera; Yacine Brahimi; Cristian Tello; Vincent Aboubakar | FC Basel: Tomás Vaclík; Walter Samuel; Fabian Schär; Behrang Safari; Taulant Xhaka; Luca Zuffi; Fabian Frei; Mohamed Elneny; Shkelzen Gashi; Derlis González; Marco Streller,NULL,30,20,10,14,10,4,Brahimi 14'; Herrera 47'; Casemiro 56'; Aboubakar 76',NULL,22'' Bruno Martins Indi x Danilo; 57'' Breel Embolo x Fabian Schär; 63'' Yoichiro Kakitani x Fabian Frei; 74'' Rúben Neves x Yacine Brahimi; 77'' Davide Callà x Shkelzen Gashi; 79'' Ricardo Quaresma x Evandro Goebel,Shkelzen Gashi 30''; Derlis González 38''; Walter Samuel 49''; Iván Marcano 55''; Behrang Safari 55'',Walter Samuel 90'+1'',51%,48%,23,4,19,7,3,4
2014-2015,Octavos,Ida,17-02-2015,19:45,21:45,Juventus,Borussia Dortmund,2-1,5-1,Juventus Stadium,Turin,Italia,NULL,Pau Cebrián Devís; Roberto del Palomar,Massimiliano Allegri,Jurgen Klopp,Juventus: Gianluigi Buffon; Giorgio Chiellini; Stephan Lichtsteiner; Patrice Evra; Leonardo Bonucci; Claudio Marchisio; Arturo Vidal; Paul Pogba; Andrea Pirlo; Álvaro Morata; Carlos Tevez | Borussia Dortmund: Roman Weidenfeller; Mats Hummels; Sokratis Papastathopoulos; Marcel Schmelzer; Lukasz Piszczek; Henrikh Mkhitaryan; Nuri Sahin; Ilkay Gündogan; Marco Reus; Pierre-Emerick Aubameyang; Ciro Immobile,NULL,39,19,20,12,6,6,Tevez 13'; Morata 43'; Reus 18',NULL,32'' Matthias Ginter x Lukasz Piszczek; 37'' Roberto Pereyra x Andrea Pirlo; 45'' Oliver Kirch x Sokratis Papastathopoulos; 76'' Jakub Blaszczykowski x Ciro Immobile; 86'' Simone Padoin x Arturo Vidal; 89'' Kingsley Coman x Carlos Tevez,Arturo Vidal 48''; Roberto Pereyra 79'',NULL,46%,53%,17,8,9,20,4,16
2014-2015,Octavos,Vuelta,18-03-2015,19:45,21:45,Borussia Dortmund,Juventus,0-3,1-5,Signal Iduna Park,Dortmund,Alemania,Milorad Mažić,Milovan Ristić; Dalibor Djurdjević,Jurgen Klopp,Massimiliano Allegri,Borussia Dortmund: Roman Weidenfeller; Mats Hummels; Neven Subotic; Marcel Schmelzer; Sokratis Papastathopoulos; Marco Reus; Ilkay Gündogan; Sven Bender; Henrikh Mkhitaryan; Kevin Kampl; Pierre-Emerick Aubameyang | Juventus: Gianluigi Buffon; Giorgio Chiellini; Leonardo Bonucci; Patrice Evra; Stephan Lichtsteiner; Carlos Tevez; Claudio Marchisio; Roberto Pereyra; Paul Pogba; Arturo Vidal; Álvaro Morata,NULL,27,12,15,13,4,9,Tevez 3'; Morata 70'; Tevez 79',NULL,27'' Andrea Barzagli x Paul Pogba; 45'' Oliver Kirch x Marcel Schmelzer; 63'' Adrián Ramos x Sven Bender; 63'' Jakub Blaszczykowski x Henrikh Mkhitaryan; 78'' Alessandro Matri x Álvaro Morata; 81'' Simone Pepe x Carlos Tevez,Marco Reus 73'',NULL,55%,44%,15,7,8,16,12,4
2014-2015,Cuartos,Ida,14-04-2015,18:45,20:45,Atletico Madrid,Real Madrid,0-0,0-1,Vicente Calderon,Madrid,España,Milorad Mažić,Milovan Ristić; Dalibor Djurdjević,Diego Simeone,Carlo Ancelotti,Atlético Madrid: Jan Oblak; Diego Godín; Miranda; Guilherme Siqueira; Juanfran; Mario Suárez; Gabi; Koke; Arda Turan; Mario Mandzukic; Antoine Griezmann | Real Madrid: Iker Casillas; Sergio Ramos; Raphaël Varane; Marcelo; Dani Carvajal; Toni Kroos; James Rodríguez; Luka Modric; Cristiano Ronaldo; Gareth Bale; Karim Benzema,NULL,25,8,17,10,2,8,NULL,NULL,76'' Isco x Karim Benzema; 77'' Raúl García x Antoine Griezmann; 83'' Fernando Torres x Koke; 85'' Álvaro Arbeloa x Dani Carvajal,Mario Mandzukic 55''; Sergio Ramos 80''; Raúl García 80''; Mario Suárez 85''; Marcelo 89'',NULL,39%,61%,30,19,11,12,7,5
2014-2015,Cuartos,Vuelta,22-04-2015,18:45,20:45,Real Madrid,Atletico Madrid,1-0,1-0,Santiago Bernabeu,Madrid,España,Felix Brych,Stefan Lupp; Mark Borsch,Carlo Ancelotti,Diego Simeone,Real Madrid: Iker Casillas; Raphaël Varane; Pepe; Fábio Coentrão; Dani Carvajal; Toni Kroos; Isco; Sergio Ramos; Cristiano Ronaldo; James Rodríguez; Javier Hernández | Atlético Madrid: Jan Oblak; Diego Godín; Miranda; Jesús Gámez; Juanfran; Tiago; Koke; Saúl Ñíguez; Arda Turan; Mario Mandzukic; Antoine Griezmann,NULL,29,23,6,10,8,2,Chicharito 88',NULL,45'' Gabi x Saúl Ñíguez; 65'' Raúl García x Antoine Griezmann; 86'' José María Giménez x Tiago; 90'+1'' Álvaro Arbeloa x Fábio Coentrão; 90'+2'' Jesé x Javier Hernández; 90'+3'' Asier Illarramendi x Isco,Arda Turan 31''; Raúl García 74''; Pepe 74''; Álvaro Arbeloa 90'+3''; Koke 90'+4'',Arda Turan,63%,37%,27,15,12,14,10,4
2014-2015,Cuartos,Ida,14-04-2015,18:45,20:45,PSG,Barcelona,1-3,1-5,Parc des Princes,Paris,Francia,NULL,Simon Beck; Jacob Dorian Collin,Laurent Blanc,Luis Enrique,Barcelona: Marc-André ter Stegen; Javier Mascherano; Gerard Piqué; Jordi Alba; Martín Montoya; Sergio Busquets; Andrés Iniesta; Ivan Rakitić; Neymar; Lionel Messi; Luis Suárez | Paris Saint-Germain: Salvatore Sirigu; Marquinhos; Thiago Silva; Maxwell; Gregory van der Wiel; Yohan Cabaye; Blaise Matuidi; Adrien Rabiot; Javier Pastore; Ezequiel Lavezzi; Edinson Cavani,NULL,19,11,8,10,6,4,Neymar 18'; 34'; Suarez 67'; Van der Wiel 82',NULL,21'' David Luiz x Thiago Silva; 53'' Xavi x Andrés Iniesta; 65'' Lucas Moura x Adrien Rabiot; 74'' Jérémy Mathieu x Ivan Rakitić; 80'' Adriano x Martín Montoya,Gerard Piqué 32''; Yohan Cabaye 37''; Lionel Messi 54'',NULL,66%,34%,22,12,10,8,4,4
2014-2015,Cuartos,Vuelta,21-04-2015,18:45,20:45,Barcelona,PSG,2-0,5-1,Camp Nou,Barcelona,España,Svein Oddvar Moen,Frank Andås; Kim Thomas Haglund,Luis Enrique,Laurent Blanc,Barcelona: Marc-André ter Stegen; Javier Mascherano; Gerard Piqué; Jordi Alba; Dani Alves; Sergio Busquets; Andrés Iniesta; Ivan Rakitić; Neymar; Lionel Messi; Luis Suárez | Paris Saint-Germain: Salvatore Sirigu; David Luiz; Marquinhos; Maxwell; Gregory van der Wiel; Zlatan Ibrahimovic; Marco Verratti; Javier Pastore; Blaise Matuidi; Yohan Cabaye; Edinson Cavani,NULL,20,11,9,8,6,2,Neymar 14'; 34',NULL,45'' Xavi x Andrés Iniesta; 55'' Sergi Roberto x Sergio Busquets; 66'' Lucas Moura x Yohan Cabaye; 75'' Pedro x Luis Suárez; 80'' Ezequiel Lavezzi x Edinson Cavani; 80'' Adrien Rabiot x Blaise Matuidi,David Luiz 3'',NULL,57%,43%,27,11,16,6,5,1
2014-2015,Cuartos,Ida,15-04-2015,18:45,20:45,Porto,Bayern Munich,3-1,4-7,Estadio do Dragao,Porto,Portugal,Carlos Velasco Carballo,Roberto Alonso Fernández; Juan Carlos Yuste,Julen Lopetegui,Pep Guardiola,FC Porto: Fabiano; Bruno Martins Indi; Maicon; Alex Sandro; Danilo; Casemiro; Óliver Torres; Héctor Herrera; Yacine Brahimi; Ricardo Quaresma; Jackson Martínez | Bayern Munich: Manuel Neuer; Dante; Jérôme Boateng; Juan Bernat; Rafinha; Robert Lewandowski; Xabi Alonso; Mario Götze; Thiago Alcantara; Philipp Lahm; Thomas Müller,NULL,11,6,5,7,4,3,Quaresma 3'; 10'; Martinez 65'; Thiago 28',NULL,56'' Sebastian Rode x Mario Götze; 74'' Holger Badstuber x Xabi Alonso; 75'' Rúben Neves x Óliver Torres; 80'' Hernâni  x Yacine Brahimi; 84'' Evandro Goebel x Ricardo Quaresma,Manuel Neuer 2''; Juan Bernat 16''; Casemiro 31''; Alex Sandro 37''; Philipp Lahm 38''; Sebastian Rode 71''; Danilo 83'',Ricardo Quaresma 3'',32%,68%,38,16,22,9,3,6
2014-2015,Cuartos,Vuelta,21-04-2015,18:45,20:45,Bayern Munich,Porto,6-1,7-4,Allianz Arena,Munich,Alemania,Martin Atkinson,Michael Mullarkey; Stephen Child,Pep Guardiola,Julen Lopetegui,Bayern Munich: Manuel Neuer; Holger Badstuber; Jérôme Boateng; Juan Bernat; Rafinha; Xabi Alonso; Thiago Alcantara; Philipp Lahm; Mario Götze; Thomas Müller; Robert Lewandowski | FC Porto: Fabiano; Iván Marcano; Maicon; Bruno Martins Indi; Diego Reyes; Casemiro; Óliver Torres; Héctor Herrera; Yacine Brahimi; Ricardo Quaresma; Jackson Martínez,NULL,24,21,3,11,10,1,Thiago 14'; Boateng 22'; Lewandowski 27'; Muller 36'; Alonso 40'; Lewandowski 64'; Martinez 73',NULL,33'' Ricardo Pereira x Diego Reyes; 45'' Rúben Neves x Ricardo Quaresma; 67'' Evandro Goebel x Yacine Brahimi; 72'' Sebastian Rode x Rafinha; 86'' Mitchell Weiser x Mario Götze; 90'' Dante x Thiago Alcantara,Héctor Herrera 34''; Jackson Martínez 38''; Holger Badstuber 42''; Ricardo Pereira 65''; Iván Marcano 71'',Iván Marcano 87'',55%,45%,38,19,19,5,4,1
2014-2015,Cuartos,Ida,15-04-2015,18:45,20:45,Juventus,Monaco,1-0,1-0,Juventus Stadium,Turin,Italia,NULL,Roman Slyško; Martin Wilczek,Massimiliano Allegri,Leonardo Jardim,Juventus: Gianluigi Buffon; Giorgio Chiellini; Leonardo Bonucci; Patrice Evra; Stephan Lichtsteiner; Carlos Tevez; Andrea Pirlo; Roberto Pereyra; Arturo Vidal; Claudio Marchisio; Álvaro Morata | AS Monaco: Danijel Subasic; Aymen Abdennour; Ricardo Carvalho; Layvin Kurzawa; Andrea Raggi; João Moutinho; Geoffrey Kondogbia; Fabinho; Yannick Carrasco; Nabil Dirar; Anthony Martial,NULL,29,13,16,9,5,4,Vidal 57',NULL,51'' Bernardo Silva x Nabil Dirar; 71'' Dimitar Berbatov x Andrea Raggi; 74'' Andrea Barzagli x Andrea Pirlo; 83'' Alessandro Matri x Álvaro Morata; 87'' Matheus Carvalho x Anthony Martial; 87'' Stefano Sturaro x Roberto Pereyra,Ricardo Carvalho 55'',Arturo Vidal 57'',64%,36%,22,7,15,13,6,7
2014-2015,Cuartos,Vuelta,22-04-2015,18:45,20:45,Monaco,Juventus,0-0,0-1,Stade Louis II,Monaco,Monaco,William Collum,Damien MacGraith; Graham Chambers,Leonardo Jardim,Massimiliano Allegri,AS Monaco: Danijel Subasic; Aymen Abdennour; Andrea Raggi; Layvin Kurzawa; Fabinho; João Moutinho; Geoffrey Kondogbia; Jérémy Toulalan; Yannick Carrasco; Bernardo Silva; Anthony Martial | Juventus: Gianluigi Buffon; Leonardo Bonucci; Giorgio Chiellini; Andrea Barzagli; Arturo Vidal; Claudio Marchisio; Andrea Pirlo; Patrice Evra; Stephan Lichtsteiner; Carlos Tevez; Álvaro Morata,NULL,17,12,5,2,1,1,NULL,NULL,45'' Dimitar Berbatov x Jérémy Toulalan; 69'' Fernando Llorente x Álvaro Morata; 76'' Valère Germain x Anthony Martial; 77'' Roberto Pereyra x Arturo Vidal; 87'' Matheus Carvalho x Yannick Carrasco; 90'' Simone Padoin x Patrice Evra,Giorgio Chiellini 1''; Bernardo Silva 50''; Geoffrey Kondogbia 76''; Carlos Tevez 86'',NULL,56%,44%,31,14,17,10,6,4
2014-2015,Semifinal,Ida,05-05-2015,18:45,20:45,Juventus,Real Madrid,2-1,3-2,Juventus Stadium,Turin,Italia,Martin Atkinson,Michael Mullarkey; Stephen Child,Massimiliano Allegri,Carlo Ancelotti,Juventus: Gianluigi Buffon; Giorgio Chiellini; Leonardo Bonucci; Patrice Evra; Stephan Lichtsteiner; Álvaro Morata; Andrea Pirlo; Arturo Vidal; Stefano Sturaro; Claudio Marchisio; Carlos Tevez | Real Madrid: Iker Casillas; Raphaël Varane; Pepe; Marcelo; Dani Carvajal; Toni Kroos; Sergio Ramos; Isco; James Rodríguez; Cristiano Ronaldo; Gareth Bale,NULL,25,12,13,11,7,4,Morata 8'; Tevez 58'; Ronaldo 27',NULL,63'' Javier Hernández x Isco; 64'' Andrea Barzagli x Stefano Sturaro; 78'' Fernando Llorente x Álvaro Morata; 86'' Roberto Pereyra x Carlos Tevez; 86'' Jesé x Gareth Bale,Leonardo Bonucci 5''; Carlos Tevez 46''; Arturo Vidal 56''; Marcelo 57''; Dani Carvajal 75''; James Rodríguez 85''; Giorgio Chiellini 90'+3'',Carlos Tevez 57'',48%,52%,34,21,13,6,1,5
2014-2015,Semifinal,Vuelta,13-05-2015,18:45,20:45,Real Madrid,Juventus,1-1,2-3,Santiago Bernabeu,Madrid,España,Jonas Eriksson,Daniel Wärnmark; Mathias Klasenius,Carlo Ancelotti,Massimiliano Allegri,Real Madrid: Iker Casillas; Sergio Ramos; Raphaël Varane; Marcelo; Dani Carvajal; Toni Kroos; James Rodríguez; Isco; Cristiano Ronaldo; Gareth Bale; Karim Benzema | Juventus: Gianluigi Buffon; Giorgio Chiellini; Leonardo Bonucci; Patrice Evra; Stephan Lichtsteiner; Álvaro Morata; Andrea Pirlo; Arturo Vidal; Paul Pogba; Claudio Marchisio; Carlos Tevez,NULL,30,23,7,9,5,4,Ronaldo 23'; Morata 57',NULL,67'' Javier Hernández x Karim Benzema; 79'' Andrea Barzagli x Andrea Pirlo; 84'' Fernando Llorente x Álvaro Morata; 89'' Roberto Pereyra x Paul Pogba,Isco 32''; James Rodríguez 44''; Carlos Tevez 70''; Stephan Lichtsteiner 76'',Cristiano Ronaldo 23'',54%,46%,18,11,7,14,8,6
2014-2015,Semifinal,Ida,06-05-2015,18:45,20:45,Barcelona,Bayern Munich,3-0,5-3,Camp Nou,Barcelona,España,Nicola Rizzoli,Elenito Di Liberatore; Mauro Tonolini,Luis Enrique,Pep Guardiola,Barcelona: Marc-André ter Stegen; Javier Mascherano; Gerard Piqué; Jordi Alba; Dani Alves; Sergio Busquets; Andrés Iniesta; Ivan Rakitić; Neymar; Lionel Messi; Luis Suárez | Bayern Munich: Manuel Neuer; Jérôme Boateng; Rafinha; Medhi Benatia; Xabi Alonso; Philipp Lahm; Juan Bernat; Thiago Alcantara; Bastian Schweinsteiger; Thomas Müller; Robert Lewandowski,NULL,23,15,8,8,8,0,Messi 77'; 80'; Neymar 90',NULL,79'' Mario Götze x Thomas Müller; 82'' Xavi x Ivan Rakitić; 87'' Rafinha x Andrés Iniesta; 89'' Marc Bartra x Javier Mascherano,Xabi Alonso 35''; Dani Alves 46''; Medhi Benatia 52''; Juan Bernat 56''; Gerard Piqué 66''; Neymar 69'',NULL,45%,55%,29,15,14,5,2,3
2014-2015,Semifinal,Vuelta,12-05-2015,18:45,20:45,Bayern Munich,Barcelona,3-2,3-5,Allianz Arena,Munich,Alemania,Mark Clattenburg,Simon Beck; Jacob Dorian Collin,Pep Guardiola,Luis Enrique,Bayern Munich: Manuel Neuer; Medhi Benatia; Jérôme Boateng; Juan Bernat; Rafinha; Xabi Alonso; Thiago Alcantara; Bastian Schweinsteiger; Philipp Lahm; Robert Lewandowski; Thomas Müller | Barcelona: Marc-André ter Stegen; Javier Mascherano; Gerard Piqué; Jordi Alba; Dani Alves; Sergio Busquets; Andrés Iniesta; Ivan Rakitić; Neymar; Lionel Messi; Luis Suárez,NULL,24,19,5,12,8,4,Benatia 7'; Lewandowski 59'; Muller 74'; Neymar 15'; 29',NULL,45'' Pedro x Luis Suárez; 68'' Sebastian Rode x Philipp Lahm; 72'' Jérémy Mathieu x Ivan Rakitić; 75'' Xavi x Andrés Iniesta; 87'' Javi Martínez x Bastian Schweinsteiger; 87'' Mario Götze x Thomas Müller,Rafinha 40''; Thiago Alcantara 45'+2''; Ivan Rakitić 64''; Robert Lewandowski 76''; Xabi Alonso 81''; Sebastian Rode 84''; Pedro 85'',NULL,54%,46%,31,19,12,6,5,1
2014-2015,Final,Final,06-06-2015,18:45,20:45,Barcelona,Juventus,3-1,NULL,Olympiastadion,Berlin,Alemania,Cüneyt Çakır,Bahattin Duran; Tarik Ongun,Luis Enrique,Massimiliano Allegri,Barcelona: Marc-André ter Stegen; Javier Mascherano; Gerard Piqué; Jordi Alba; Dani Alves; Sergio Busquets; Andrés Iniesta; Ivan Rakitić; Neymar; Lionel Messi; Luis Suárez | Juventus: Gianluigi Buffon; Leonardo Bonucci; Andrea Barzagli; Patrice Evra; Stephan Lichtsteiner; Álvaro Morata; Andrea Pirlo; Arturo Vidal; Paul Pogba; Claudio Marchisio; Carlos Tevez,NULL,31,17,14,14,8,6,Rakitic 4'; Suarez 68'; Neymar 90'; Morata 55',NULL,78'' Xavi x Andrés Iniesta; 79'' Roberto Pereyra x Arturo Vidal; 85'' Fernando Llorente x Álvaro Morata; 89'' Kingsley Coman x Patrice Evra; 90'+1'' Jérémy Mathieu x Ivan Rakitić; 90'+6'' Pedro x Luis Suárez,Arturo Vidal 11''; Paul Pogba 41''; Luis Suárez 70'',NULL,62%,38%,36,12,24,14,6,8
2015-2016,Octavos,Ida,16-02-2016,19:45,21:45,PSG,Chelsea,2-1,4-2,Parc des Princes,Paris,Francia,Carlos Velasco Carballo,Roberto Alonso Fernández; Juan Carlos Yuste,Laurent Blanc,Guus Hiddink,Chelsea: Thibaut Courtois; Branislav Ivanovic; Gary Cahill; Abdul Rahman Baba; César Azpilicueta; Willian; Cesc Fàbregas; John Obi Mikel; Eden Hazard; Pedro; Diego Costa | Paris Saint-Germain: Kevin Trapp; David Luiz; Thiago Silva; Maxwell; Marquinhos; Thiago Motta; Blaise Matuidi; Marco Verratti; Lucas Moura; Ángel Di María; Zlatan Ibrahimovic,NULL,30,10,20,13,5,8,Ibrahimovic 39'; Cavani 78'; Obi Mikel 45',NULL,71'' Oscar x Eden Hazard; 74'' Edinson Cavani x Lucas Moura; 81'' Adrien Rabiot x Marco Verratti; 81'' Javier Pastore x Blaise Matuidi,Zlatan Ibrahimovic 19''; John Obi Mikel 38''; Pedro 67''; Lucas Moura 70''; David Luiz 71'',NULL,35%,65%,31,15,16,12,3,9
2015-2016,Octavos,Vuelta,09-03-2016,19:45,21:45,Chelsea,PSG,1-2,2-4,Stamford Bridge,Londres,Inglaterra,Felix Brych,Stefan Lupp; Mark Borsch,Guus Hiddink,Laurent Blanc,Chelsea: Thibaut Courtois; Branislav Ivanovic; Gary Cahill; Kenedy; César Azpilicueta; Willian; Cesc Fàbregas; John Obi Mikel; Eden Hazard; Pedro; Diego Costa | Paris Saint-Germain: Kevin Trapp; David Luiz; Thiago Silva; Maxwell; Marquinhos; Thiago Motta; Blaise Matuidi; Adrien Rabiot; Lucas Moura; Ángel Di María; Zlatan Ibrahimovic,NULL,25,15,10,12,7,5,Costa 27'; Rabiot 16'; Ibrahimovic 67',NULL,60'' Bertrand Traoré x Diego Costa; 77'' Oscar x Eden Hazard; 77'' Javier Pastore x Lucas Moura; 82'' Edinson Cavani x Ángel Di María; 87'' Gregory van der Wiel x Blaise Matuidi,Adrien Rabiot 34''; Thiago Motta 41''; Cesc Fàbregas 45''; John Obi Mikel 53''; Blaise Matuidi 86''; Branislav Ivanovic 90'',NULL,37%,63%,29,16,13,9,5,4
